{
  "code": "BUPT_UP1",
  "slug": "bupt_university_physics_1",
  "title": "大学物理上",
  "shortTitle": "大学物理上",
  "summary": "从质点运动学和牛顿力学出发，学习功与能、动量、刚体转动，再进入热力学（气体动理论和热力学定律），建立经典物理的完整图景。",
  "route": [
    "质点运动学",
    "牛顿运动定律",
    "功与能",
    "动量与碰撞",
    "刚体转动",
    "气体动理论",
    "热力学第一定律",
    "热力学第二定律"
  ],
  "chapters": [
    {
      "title": "第1章：质点运动学",
      "focus": "参考系与坐标系、位置矢量/位移/速度/加速度、直线运动与曲线运动、抛体运动、圆周运动（角量与线量关系）、相对运动。",
      "checklist": [
        "掌握位置/速度/加速度的微分与积分关系",
        "能够分析抛体运动和圆周运动",
        "理解角量与线量的换算关系",
        "了解相对运动的描述方法"
      ]
    },
    {
      "title": "第2章：牛顿运动定律",
      "focus": "牛顿三定律、常见力（重力/弹力/摩擦力）、牛顿定律的应用（受力分析+列方程）、非惯性系与惯性力。",
      "checklist": [
        "能够正确进行受力分析",
        "掌握用牛顿第二定律列方程求解",
        "理解惯性力的概念",
        "能够分析连接体问题"
      ]
    },
    {
      "title": "第3章：功与能",
      "focus": "功的定义与计算、动能定理、保守力与势能、功能原理、机械能守恒定律。",
      "checklist": [
        "能够计算各种力的功",
        "掌握动能定理的应用",
        "理解保守力与势能的关系",
        "能够应用机械能守恒定律"
      ]
    },
    {
      "title": "第4章：动量与碰撞",
      "focus": "动量与冲量、动量定理、动量守恒定律、碰撞（弹性/完全非弹性/非弹性）、质心与质心运动定理。",
      "checklist": [
        "掌握动量定理和动量守恒定律",
        "能够分析各种碰撞问题",
        "理解质心的概念",
        "能够综合运用动量和能量守恒"
      ]
    },
    {
      "title": "第5章：刚体转动",
      "focus": "刚体定轴转动、转动惯量（平行轴定理）、转动定律（力矩→角加速度）、转动动能、角动量与角动量守恒。",
      "checklist": [
        "能够计算刚体的转动惯量",
        "掌握转动定律的应用",
        "理解角动量守恒定律",
        "能够综合运用平动和转动"
      ]
    },
    {
      "title": "第6章：气体动理论",
      "focus": "理想气体状态方程、压强公式（微观解释）、温度的统计意义、能量均分定理、Maxwell速率分布、平均自由程。",
      "checklist": [
        "理解压强的微观解释",
        "掌握能量均分定理的应用",
        "了解Maxwell速率分布的含义",
        "能够计算理想气体的内能"
      ]
    },
    {
      "title": "第7章：热力学第一定律",
      "focus": "内能/功/热量、热力学第一定律、等温/等压/等体/绝热过程、循环过程（Carnot循环）、热机效率。",
      "checklist": [
        "掌握热力学第一定律的应用",
        "能够计算各等值过程中的功和热量",
        "掌握Carnot循环的效率公式",
        "理解热机效率的含义"
      ]
    },
    {
      "title": "第8章：热力学第二定律",
      "focus": "热力学第二定律的两种表述（Kelvin/Clasius）、可逆与不可逆过程、熵的概念、熵增加原理、Boltzmann公式。",
      "checklist": [
        "理解热力学第二定律的两种表述",
        "区分可逆与不可逆过程",
        "掌握熵变的计算方法",
        "理解熵增加原理的含义"
      ]
    }
  ],
  "mindMap": [
    {
      "title": "运动学",
      "children": [
        "位置/速度/加速度",
        "抛体运动",
        "圆周运动",
        "相对运动"
      ]
    },
    {
      "title": "牛顿力学",
      "children": [
        "受力分析",
        "牛顿第二定律",
        "惯性力",
        "连接体问题"
      ]
    },
    {
      "title": "功与能",
      "children": [
        "功的计算",
        "动能定理",
        "势能",
        "机械能守恒"
      ]
    },
    {
      "title": "动量",
      "children": [
        "动量定理",
        "动量守恒",
        "碰撞",
        "质心"
      ]
    },
    {
      "title": "刚体转动",
      "children": [
        "转动惯量",
        "转动定律",
        "角动量守恒",
        "转动动能"
      ]
    },
    {
      "title": "热力学",
      "children": [
        "能量均分定理",
        "热力学第一定律",
        "Carnot循环",
        "熵增加原理"
      ]
    }
  ],
  "studySummary": [
    {
      "title": "核心概念",
      "points": [
        "牛顿第二定律是经典力学的核心方程",
        "能量守恒和动量守恒是解决力学问题的两大工具",
        "热力学第一定律是能量守恒在热现象中的体现",
        "熵增加原理给出了过程进行方向的判据"
      ]
    },
    {
      "title": "题型抓手",
      "points": [
        "力学题：先受力分析，再选守恒定律（能量/动量/角动量）",
        "碰撞题：区分弹性/非弹性，列动量守恒+能量关系",
        "热力学题：判断过程类型，用第一定律列方程",
        "Carnot循环：记住效率公式 η=1-T₂/T₁"
      ]
    },
    {
      "title": "易混点",
      "points": [
        "功的正负取决于力与位移的夹角",
        "保守力做功与路径无关，非保守力做功与路径有关",
        "弹性碰撞动能守恒，完全非弹性碰撞动能损失最大",
        "热量和功是过程量，内能是状态量",
        "熵增加原理只适用于孤立系统"
      ]
    }
  ],
  "outcomes": [
    "掌握经典力学的基本定律与分析方法",
    "能够运用守恒定律解决力学问题",
    "理解热力学基本定律的物理意义",
    "为后续大学物理下（电磁学/光学/近代物理）奠定基础"
  ],
  "resources": [
    {
      "title": "大学物理力学与热学练习",
      "type": "习题",
      "description": "牛顿力学、守恒定律、热力学等典型计算题集。"
    },
    {
      "title": "物理实验指导",
      "type": "实验",
      "description": "气垫导轨、转动惯量测量等经典力学实验指导。"
    }
  ],
  "publicMaterials": [
    {
      "title": "物理学（第七版）上册",
      "type": "教材",
      "description": "马文蔚等编，高等教育出版社。"
    },
    {
      "title": "MIT 8.01 Classical Mechanics",
      "type": "公开课",
      "description": "Walter Lewin主讲的经典力学课程。",
      "url": "https://ocw.mit.edu/courses/8-01sc-classical-mechanics-fall-2016/"
    },
    {
      "title": "费曼物理学讲义 第一卷",
      "type": "参考书",
      "description": "费曼著，经典物理学参考书，物理直觉极佳。",
      "url": "https://www.feynmanlectures.caltech.edu/I_toc.html"
    }
  ],
  "reviewNotes": [
    "大学物理上涵盖力学和热力学两大部分。",
    "守恒定律（能量/动量/角动量）是解题的核心工具。",
    "热力学过程的计算需要清楚各等值过程的特点。",
    "考试重点：牛顿定律应用、守恒定律、Carnot循环、熵变计算。"
  ]
}
