{
  "code": "BUPT_DSA",
  "slug": "bupt_data_structures_algorithms",
  "title": "数据结构与算法",
  "shortTitle": "数据结构",
  "summary": "从线性表到树和图，系统学习各类数据结构的逻辑结构、存储实现和操作算法，掌握排序、查找等核心算法及复杂度分析方法。",
  "route": [
    "绪论与算法分析",
    "线性表",
    "栈与队列",
    "串（KMP算法）",
    "树与二叉树",
    "图",
    "查找",
    "排序"
  ],
  "chapters": [
    {
      "title": "第1章：绪论",
      "focus": "数据结构基本概念（数据/数据元素/数据对象）、逻辑结构（集合/线性/树形/图状）、物理结构（顺序/链式）、抽象数据类型(ADT)、算法特性、时间复杂度分析（大O表示法）。",
      "checklist": [
        "理解四种逻辑结构的特点",
        "区分顺序存储与链式存储",
        "掌握时间复杂度的分析方法",
        "能够分析循环和递归算法的复杂度"
      ]
    },
    {
      "title": "第2章：线性表",
      "focus": "顺序表（数组实现）的插入删除、单链表的插入删除查找、头结点的作用、头插法与尾插法建表、双向链表、循环链表。",
      "checklist": [
        "掌握顺序表和单链表的基本操作",
        "能够处理链表操作的边界条件",
        "理解头结点的作用",
        "掌握头插法和尾插法建表"
      ]
    },
    {
      "title": "第3章：栈与队列",
      "focus": "顺序栈与链栈实现、栈的应用（括号匹配/表达式求值/递归转非递归）、循环队列（判满条件）、链队列、两个栈模拟队列。",
      "checklist": [
        "掌握栈的基本操作与应用场景",
        "理解循环队列的设计与判满条件",
        "能够用栈实现表达式求值",
        "理解栈在递归中的作用"
      ]
    },
    {
      "title": "第4章：串",
      "focus": "串的存储表示、BF朴素模式匹配、KMP算法（next数组的构造与理解）。",
      "checklist": [
        "掌握KMP算法的next数组求解",
        "理解next数组的含义",
        "能够手动执行KMP匹配过程",
        "了解nextval优化"
      ]
    },
    {
      "title": "第5章：数组与广义表",
      "focus": "数组顺序存储（行优先/列优先地址计算）、特殊矩阵压缩存储（对称/三角/对角/稀疏矩阵）、三元组表示。",
      "checklist": [
        "掌握特殊矩阵的下标映射公式",
        "能够计算行优先/列优先存储的地址",
        "了解稀疏矩阵的三元组表示",
        "理解压缩存储的意义"
      ]
    },
    {
      "title": "第6章：树与二叉树",
      "focus": "二叉树性质、遍历（先序/中序/后序/层序，递归与非递归）、由遍历序列构造二叉树、线索二叉树、树与森林的转换、哈夫曼树与哈夫曼编码。",
      "checklist": [
        "掌握二叉树的递归与非递归遍历",
        "能够由先序+中序或后序+中序构造二叉树",
        "掌握哈夫曼树的构造与WPL计算",
        "理解树、森林与二叉树的转换"
      ]
    },
    {
      "title": "第7章：图",
      "focus": "图的基本概念、邻接矩阵与邻接表存储、DFS与BFS遍历、最小生成树（Prim/Kruskal）、最短路径（Dijkstra/Floyd）、拓扑排序、关键路径。",
      "checklist": [
        "掌握DFS和BFS的执行过程",
        "能够手动执行Dijkstra和Floyd算法",
        "理解Prim和Kruskal算法的区别",
        "掌握拓扑排序和关键路径的求解"
      ]
    },
    {
      "title": "第8章：查找",
      "focus": "顺序查找、折半查找（判定树）、分块查找、二叉排序树(BST)、平衡二叉树(AVL树四种旋转)、B树/B+树、散列表（哈希表）。",
      "checklist": [
        "掌握折半查找的判定树构造",
        "能够进行AVL树的四种旋转操作",
        "掌握散列表的构造与冲突处理",
        "理解装填因子与查找效率的关系"
      ]
    },
    {
      "title": "第9章：排序",
      "focus": "直接插入/折半插入/希尔排序、冒泡/快速排序、选择/堆排序、归并排序、基数排序、各排序算法的时间/空间/稳定性比较。",
      "checklist": [
        "能够手动执行快速排序的划分过程",
        "掌握堆排序的建堆和调整过程",
        "能够比较各排序算法的性能",
        "理解排序算法稳定性的含义"
      ]
    }
  ],
  "mindMap": [
    {
      "title": "线性结构",
      "children": [
        "顺序表与链表",
        "栈与队列",
        "串与KMP算法",
        "数组与矩阵"
      ]
    },
    {
      "title": "树形结构",
      "children": [
        "二叉树遍历",
        "由遍历构造二叉树",
        "哈夫曼树",
        "AVL树"
      ]
    },
    {
      "title": "图结构",
      "children": [
        "DFS与BFS",
        "最小生成树",
        "最短路径",
        "拓扑排序"
      ]
    },
    {
      "title": "查找",
      "children": [
        "折半查找",
        "BST与AVL树",
        "B树/B+树",
        "散列表"
      ]
    },
    {
      "title": "排序",
      "children": [
        "快速排序",
        "堆排序",
        "归并排序",
        "稳定性比较"
      ]
    },
    {
      "title": "算法分析",
      "children": [
        "时间复杂度",
        "空间复杂度",
        "大O表示法",
        "最好/最坏/平均"
      ]
    }
  ],
  "studySummary": [
    {
      "title": "核心概念",
      "points": [
        "数据结构=逻辑结构+物理结构+操作算法",
        "时间复杂度分析是算法评价的核心",
        "二叉树遍历是树形结构的基础操作",
        "图的最短路径和最小生成树是经典算法"
      ]
    },
    {
      "title": "题型抓手",
      "points": [
        "链表题：画图标注指针变化，注意边界条件",
        "二叉树题：利用递归性质，先序+中序可唯一确定",
        "图算法题：手动执行Dijkstra/Prim，画表格",
        "排序题：快速排序划分用左右指针，堆排序从最后非叶子节点开始"
      ]
    },
    {
      "title": "易混点",
      "points": [
        "KMP算法next数组的含义与求解",
        "先序+后序不能唯一确定二叉树",
        "Dijkstra不能处理负权边",
        "快速排序最坏情况O(n²)（已排序数组）",
        "排序稳定性：相同关键字元素的相对位置"
      ]
    }
  ],
  "outcomes": [
    "掌握各类数据结构的逻辑结构与存储实现",
    "能够分析算法的时间与空间复杂度",
    "掌握图的经典算法（最短路径/最小生成树/拓扑排序）",
    "能够比较和选择合适的排序算法"
  ],
  "resources": [
    {
      "title": "数据结构编程练习",
      "type": "实验",
      "description": "链表、二叉树、图等数据结构的C/C++编程实现。"
    },
    {
      "title": "排序算法可视化",
      "type": "实验",
      "description": "各排序算法的动态可视化演示工具。"
    },
    {
      "title": "KMP算法next数组求解练习",
      "type": "习题",
      "description": "next数组手动求解的详细步骤与练习题。"
    }
  ],
  "publicMaterials": [
    {
      "title": "数据结构（C语言版）",
      "type": "教材",
      "description": "严蔚敏编，清华大学出版社，国内经典数据结构教材。"
    },
    {
      "title": "浙江大学陈越《数据结构》",
      "type": "公开课",
      "description": "中国大学MOOC经典课程，B站可看。",
      "url": "https://www.icourse163.org/course/ZJU-93001"
    },
    {
      "title": "算法导论（CLRS）",
      "type": "参考书",
      "description": "Cormen等著，算法领域最权威的参考书。"
    },
    {
      "title": "LeetCode",
      "type": "官方教程",
      "description": "在线算法练习平台，按标签分类练习。",
      "url": "https://leetcode.cn/"
    }
  ],
  "reviewNotes": [
    "数据结构是计算机科学的核心课程，需要大量编程练习。",
    "KMP算法的next数组是考试高频考点，需要熟练掌握。",
    "图的算法（Dijkstra/Floyd/Prim）需要手动执行练习。",
    "排序算法的比较（时间/空间/稳定性）是常见选择题。"
  ]
}
