{
  "code": "BUPT_SCIP",
  "slug": "bupt_satellite_comm_innovation_practice",
  "title": "卫星通信创新实践",
  "shortTitle": "卫星通信实践",
  "summary": "以项目驱动的创新实践课程，从卫星通信系统基础到SDR信号接收、地面站搭建，最终完成创新项目设计与演示。",
  "route": [
    "卫星通信系统概述",
    "卫星通信信号处理基础",
    "SDR软件无线电实验",
    "卫星信号接收与解调",
    "地面站设计与搭建",
    "链路仿真与星地一体化",
    "创新项目设计与实现",
    "模块一：卫星通信系统概述",
    "模块二：卫星通信信号处理基础"
  ],
  "chapters": [
    {
      "title": "模块一：卫星通信系统概述",
      "focus": "卫星通信链路组成（上行/下行/星间链路）；卫星通信频段与电波传播特性；链路预算分析（EIRP、G/T、C/N、降雨衰减）；典型卫星通信系统（VSAT、直播卫星、星链）。",
      "checklist": [
        "能够画出卫星通信链路的基本组成框图",
        "掌握EIRP、G/T值、C/N的物理含义与计算方法",
        "理解降雨衰减对Ku/Ka波段链路的影响",
        "了解VSAT、星链等典型卫星通信系统的特点",
        "能说清卫星通信链路组成的定义、作用和适用场景",
        "能把上行与本章其他知识点建立联系",
        "能围绕下行完成典型题或实验步骤分析"
      ]
    },
    {
      "title": "模块二：卫星通信信号处理基础",
      "focus": "数字调制技术（BPSK、QPSK、8PSK、16APSK、DVB-S2标准）；信道编码（卷积码、Turbo码、LDPC码）；OFDM技术在卫星通信中的应用；扩频通信与CDMA。",
      "checklist": [
        "掌握BPSK、QPSK、8PSK等调制方式的原理与频谱效率",
        "理解DVB-S2标准中ACM（自适应编码调制）的工作机制",
        "了解LDPC码与Turbo码在卫星通信中的应用",
        "理解扩频通信在卫星通信中的优势",
        "能说清数字调制技术的定义、作用和适用场景",
        "能把BPSK与本章其他知识点建立联系",
        "能围绕QPSK完成典型题或实验步骤分析"
      ]
    },
    {
      "title": "模块三：SDR软件无线电实验",
      "focus": "SDR基础与平台介绍（RTL-SDR、HackRF、USRP、PlutoSDR）；GNU Radio基本操作；频谱扫描与信号捕获；IQ信号采集与处理。",
      "checklist": [
        "了解主流SDR平台的特点与适用场景",
        "能够使用GNU Radio搭建基本信号处理流图",
        "完成频谱扫描与信号捕获实验",
        "理解IQ信号的采集与基本处理方法",
        "能说清SDR基础与平台介绍的定义、作用和适用场景",
        "能把RTL-SDR与本章其他知识点建立联系",
        "能围绕HackRF完成典型题或实验步骤分析"
      ]
    },
    {
      "title": "模块四：卫星信号接收与解调实验",
      "focus": "接收气象卫星信号（NOAA APT/Meteor LRPT）；接收业余卫星信号；DVB-S/S2信号解调实验；低轨卫星多普勒频移测量与补偿。",
      "checklist": [
        "能够使用SDR接收并解调NOAA气象卫星APT信号",
        "完成DVB-S/S2信号的解调实验",
        "理解低轨卫星多普勒频移的产生原因与补偿方法",
        "能够对卫星信号进行频谱分析与质量评估",
        "能说清接收气象卫星信号的定义、作用和适用场景",
        "能把NOAA APT与本章其他知识点建立联系",
        "能围绕Meteor LRPT完成典型题或实验步骤分析"
      ]
    },
    {
      "title": "模块五：地面站设计与搭建",
      "focus": "地面站系统架构设计；天线选型与安装（螺旋天线、八木天线、抛物面天线）；LNA(低噪声放大器)与馈线系统；跟踪系统设计（程序跟踪、自动跟踪）。",
      "checklist": [
        "掌握地面站系统架构与各组成部分的功能",
        "能够根据任务需求选择合适的天线类型",
        "理解LNA与馈线系统对接收灵敏度的影响",
        "了解程序跟踪与自动跟踪的基本原理",
        "能说清地面站系统架构设计的定义、作用和适用场景",
        "能把天线选型与安装与本章其他知识点建立联系",
        "能围绕螺旋天线完成典型题或实验步骤分析"
      ]
    },
    {
      "title": "模块六：链路仿真与星地一体化",
      "focus": "MATLAB/Python链路仿真；信道模型（AWGN、Rician、Rayleigh衰落）；自适应编码调制(ACM)策略仿真；雨衰模型与可用度分析；非地面网络(NTN)概念与3GPP NTN。",
      "checklist": [
        "能够使用MATLAB/Python完成卫星链路仿真",
        "掌握AWGN、Rician、Rayleigh信道模型的适用场景",
        "理解ACM策略的工作原理与仿真方法",
        "了解3GPP NTN标准与星地一体化通信的发展趋势",
        "能说清MATLAB的定义、作用和适用场景",
        "能把Python链路仿真与本章其他知识点建立联系",
        "能围绕信道模型完成典型题或实验步骤分析"
      ]
    },
    {
      "title": "模块七：创新项目设计与实现",
      "focus": "自选创新课题（卫星物联网原型、星地一体化通信演示、低功耗卫星终端设计等）；方案设计、原型开发、测试验证；项目答辩与成果展示。",
      "checklist": [
        "能够提出具有创新性的卫星通信应用方案",
        "完成方案设计、原型开发与测试验证的完整流程",
        "具备项目答辩与成果展示的能力",
        "撰写规范的项目文档与技术报告",
        "能说清自选创新课题的定义、作用和适用场景",
        "能把卫星物联网原型与本章其他知识点建立联系",
        "能围绕星地一体化通信演示完成典型题或实验步骤分析"
      ]
    }
  ],
  "mindMap": [
    {
      "title": "卫星通信基础",
      "children": [
        "链路预算分析",
        "EIRP与G/T值",
        "降雨衰减",
        "典型卫星通信系统"
      ]
    },
    {
      "title": "信号处理技术",
      "children": [
        "BPSK/QPSK/8PSK调制",
        "DVB-S2标准与ACM",
        "LDPC/Turbo信道编码",
        "扩频通信与CDMA"
      ]
    },
    {
      "title": "SDR实验",
      "children": [
        "SDR平台（USRP/HackRF/PlutoSDR）",
        "GNU Radio流图搭建",
        "频谱扫描与信号捕获",
        "IQ信号处理"
      ]
    },
    {
      "title": "卫星信号接收",
      "children": [
        "气象卫星信号（NOAA/Meteor）",
        "DVB-S/S2信号解调",
        "多普勒频移补偿",
        "信号质量评估"
      ]
    },
    {
      "title": "地面站设计",
      "children": [
        "天线选型与安装",
        "LNA与馈线系统",
        "跟踪系统设计",
        "链路仿真验证"
      ]
    },
    {
      "title": "前沿方向",
      "children": [
        "非地面网络(NTN)",
        "卫星与5G/6G融合",
        "LEO星座组网",
        "卫星物联网"
      ]
    },
    {
      "title": "模块一：卫星通信系统概述",
      "children": [
        "够画出卫星通信链路的基本组成框图",
        "EIRP、G/T值、C/N的物理含义与计算方法",
        "降雨衰减对Ku/Ka波段链路的影响",
        "了解VSAT、星链等典型卫星通信系统的特点",
        "卫星通信链路组成",
        "上行"
      ]
    },
    {
      "title": "模块二：卫星通信信号处理基础",
      "children": [
        "了解LDPC码与Turbo码在卫星通信中的应用",
        "扩频通信在卫星通信中的优势",
        "数字调制技术",
        "BPSK",
        "QPSK",
        "8PSK"
      ]
    }
  ],
  "studySummary": [
    {
      "title": "核心概念",
      "points": [
        "卫星通信链路组成",
        "上行",
        "数字调制技术",
        "BPSK",
        "SDR基础与平台介绍"
      ]
    },
    {
      "title": "题型抓手",
      "points": [
        "按章节路线先建立概念框架，再补公式和流程",
        "每章至少保留一类典型题或实验场景",
        "遇到综合题时先判断所属模块，再列条件和约束",
        "复习时把图谱节点和章节 checklist 对照检查"
      ]
    },
    {
      "title": "易混点",
      "points": [
        "模块一：卫星通信系统概述中的条件、公式和适用场景",
        "模块二：卫星通信信号处理基础中的条件、公式和适用场景",
        "模块三：SDR软件无线电实验中的条件、公式和适用场景",
        "模块四：卫星信号接收与解调实验中的条件、公式和适用场景",
        "模块五：地面站设计与搭建中的条件、公式和适用场景"
      ]
    }
  ],
  "outcomes": [
    "掌握卫星通信链路预算与信号处理基础",
    "能够使用SDR平台接收和解调卫星信号",
    "完成地面站搭建与链路仿真实验",
    "设计并演示一个卫星通信创新项目"
  ],
  "resources": [
    {
      "title": "SDR卫星信号接收实验指导",
      "type": "实验",
      "description": "涵盖RTL-SDR/USRP平台的卫星信号接收、解调实验操作步骤。"
    },
    {
      "title": "GNU Radio卫星通信模块库",
      "type": "实验",
      "description": "基于GNU Radio的卫星通信信号处理模块，支持DVB-S2等标准。"
    },
    {
      "title": "链路预算计算模板",
      "type": "清单",
      "description": "Excel/Python链路预算计算模板，支持EIRP、G/T、C/N等参数计算。"
    }
  ],
  "publicMaterials": [
    {
      "title": "卫星通信系统",
      "type": "教材",
      "description": "王秉钧主编，系统介绍卫星通信的基本原理与系统设计。"
    },
    {
      "title": "Satellite Communications (Dennis Roddy)",
      "type": "参考书",
      "description": "经典卫星通信教材，涵盖链路分析、调制编码、多址接入等内容。"
    },
    {
      "title": "GNU Radio官方教程",
      "type": "官方教程",
      "description": "GNU Radio官方文档与教程，SDR入门必备。",
      "url": "https://wiki.gnuradio.org/"
    },
    {
      "title": "SatNOGS开源卫星地面站网络",
      "type": "官方教程",
      "description": "开源卫星地面站网络项目，提供地面站搭建的参考设计。",
      "url": "https://satnogs.org/"
    }
  ],
  "reviewNotes": [
    "卫星通信创新实践为项目驱动课程，创新项目的选题需提前与老师沟通。",
    "SDR平台的可用性需确认实验室设备情况（RTL-SDR较便宜，USRP较贵）。",
    "气象卫星信号接收实验需要合适的天线和接收环境（开阔无遮挡）。",
    "创新项目的评分可能包括选题新颖性、技术方案合理性、实现完整度等维度。",
    "已按验收展示需求补充章节 checklist 和知识图谱密度，具体考试范围仍建议按老师课件确认。"
  ]
}
