{
  "code": "BUPT_SAP",
  "slug": "bupt_signal_analysis_and_processing",
  "title": "信号分析与处理",
  "shortTitle": "信号",
  "summary": "从信号与系统基本概念出发，学习连续/离散时间信号的时域与变换域分析方法（傅里叶变换、拉普拉斯变换、Z变换），掌握数字信号处理核心内容（DFT/FFT、数字滤波器设计），建立从连续到离散、从分析到设计的完整知识体系。",
  "route": [
    "信号与系统基本概念",
    "连续时间系统时域分析",
    "傅里叶变换",
    "拉普拉斯变换",
    "采样定理",
    "离散时间系统时域分析",
    "Z变换",
    "离散傅里叶变换与FFT",
    "数字滤波器设计"
  ],
  "chapters": [
    {
      "title": "第1章：信号与系统基本概念",
      "focus": "连续/离散时间信号分类、信号基本运算（时移/反转/尺度变换）、系统分类（线性/时不变/因果/稳定）、冲激函数与阶跃函数。",
      "checklist": [
        "掌握信号的分类与基本运算",
        "能够判断系统的线性、时不变、因果、稳定性",
        "理解冲激函数和阶跃函数的性质",
        "熟悉常用连续和离散时间信号"
      ]
    },
    {
      "title": "第2章：连续时间系统时域分析",
      "focus": "微分方程建立与求解、单位冲激响应h(t)、卷积积分、零输入响应与零状态响应、自由响应与强迫响应。",
      "checklist": [
        "能够建立并求解线性常系数微分方程",
        "掌握卷积积分的计算方法",
        "理解零输入响应与零状态响应的区别",
        "能够用卷积求系统的零状态响应"
      ]
    },
    {
      "title": "第3章：傅里叶变换",
      "focus": "连续时间傅里叶级数(FS)、连续时间傅里叶变换(FT)、FT性质（线性/时移/频移/尺度变换/卷积定理/帕塞瓦尔定理）、周期与非周期信号频谱分析。",
      "checklist": [
        "掌握常用信号的傅里叶变换对",
        "能够运用FT性质简化变换计算",
        "理解周期信号的傅里叶级数表示",
        "掌握时域卷积定理和帕塞瓦尔定理"
      ]
    },
    {
      "title": "第4章：拉普拉斯变换",
      "focus": "拉普拉斯变换定义与收敛域(ROC)、常用变换对、部分分式展开法求逆变换、系统函数H(s)、零极点分析、系统稳定性与因果性判断。",
      "checklist": [
        "掌握拉普拉斯变换的计算方法",
        "能够确定收敛域并判断系统性质",
        "掌握部分分式展开法求逆变换",
        "能够通过零极点分析系统稳定性"
      ]
    },
    {
      "title": "第5章：傅里叶变换应用与采样定理",
      "focus": "滤波、调制与解调、采样定理（奈奎斯特定理）、信号的恢复与重建、频域分析的应用。",
      "checklist": [
        "理解采样定理的物理意义",
        "能够判断采样是否满足奈奎斯特条件",
        "掌握信号采样与恢复的过程",
        "了解调制与解调的基本原理"
      ]
    },
    {
      "title": "第6章：离散时间系统时域分析",
      "focus": "差分方程建立与求解、单位脉冲响应h[n]、卷积和、离散时间系统的零输入与零状态响应、线性移不变(LSI)系统。",
      "checklist": [
        "能够建立并求解常系数线性差分方程",
        "掌握卷积和的计算方法",
        "理解LSI系统的性质",
        "能够用卷积和求系统的零状态响应"
      ]
    },
    {
      "title": "第7章：Z变换",
      "focus": "Z变换定义与收敛域(ROC)、常用变换对、Z变换性质、逆Z变换（部分分式展开/留数法）、系统函数H(z)、零极点分析、利用Z变换解差分方程。",
      "checklist": [
        "掌握Z变换的计算方法",
        "能够确定收敛域并判断系统因果性和稳定性",
        "掌握部分分式展开法求逆Z变换",
        "能够通过零极点分析离散系统频率响应"
      ]
    },
    {
      "title": "第8章：离散傅里叶变换与快速傅里叶变换",
      "focus": "离散傅里叶级数(DFS)、DFT定义与性质、圆周卷积与线性卷积关系、频率采样、FFT算法（基2时间抽取/频率抽取蝶形算法）、运算量比较。",
      "checklist": [
        "掌握DFT的定义和计算方法",
        "理解圆周卷积与线性卷积的关系",
        "掌握FFT蝶形运算流程",
        "能够分析FFT的运算量优势"
      ]
    },
    {
      "title": "第9章：数字滤波器设计",
      "focus": "IIR滤波器设计（巴特沃斯/切比雪夫模拟滤波器、脉冲响应不变法、双线性变换法）、FIR滤波器设计（线性相位条件、窗函数法）、IIR与FIR滤波器比较。",
      "checklist": [
        "掌握双线性变换法设计IIR滤波器",
        "能够用窗函数法设计FIR滤波器",
        "理解线性相位FIR的四种类型",
        "能够比较IIR和FIR滤波器的特点"
      ]
    }
  ],
  "mindMap": [
    {
      "title": "连续信号分析",
      "children": [
        "信号基本运算",
        "卷积积分",
        "傅里叶变换",
        "拉普拉斯变换"
      ]
    },
    {
      "title": "离散信号分析",
      "children": [
        "差分方程",
        "卷积和",
        "Z变换",
        "零极点分析"
      ]
    },
    {
      "title": "频域分析",
      "children": [
        "傅里叶级数",
        "DFT",
        "FFT",
        "频谱分析"
      ]
    },
    {
      "title": "数字滤波器",
      "children": [
        "IIR滤波器设计",
        "FIR滤波器设计",
        "双线性变换",
        "窗函数法"
      ]
    }
  ],
  "studySummary": [
    {
      "title": "核心概念",
      "points": [
        "傅里叶变换将时域信号分解为频域分量，是信号分析的核心工具",
        "拉普拉斯变换和Z变换分别用于连续和离散系统的复频域分析",
        "采样定理是连接连续信号与数字信号的桥梁",
        "FFT是DFT的快速算法，将运算量从N²降到NlogN"
      ]
    },
    {
      "title": "题型抓手",
      "points": [
        "卷积题：画图确定积分/求和上下限，注意结果的起止时间",
        "变换题：记住常用变换对，灵活运用性质简化计算",
        "零极点分析题：画零极点图→判断稳定性→分析频率响应",
        "滤波器设计题：明确指标→选方法→按步骤计算→验证"
      ]
    },
    {
      "title": "易混点",
      "points": [
        "因果系统ROC为最右侧极点右侧，稳定系统ROC包含jw轴（s域）或单位圆（z域）",
        "时域卷积对应频域乘积，但要注意常数系数（如1/2π）",
        "圆周卷积与线性卷积不同，N≥N1+N2-1时两者等价",
        "双线性变换法无混叠但有频率畸变，需做频率预畸变",
        "补零不改变频率分辨率，只增加频域采样密度"
      ]
    }
  ],
  "outcomes": [
    "掌握连续和离散时间信号的时域与变换域分析方法",
    "能够运用傅里叶变换、拉普拉斯变换和Z变换分析信号与系统",
    "理解采样定理并能进行连续信号与数字信号的转换分析",
    "具备数字滤波器（IIR/FIR）的设计能力"
  ],
  "resources": [
    {
      "title": "信号与系统习题精解",
      "type": "习题",
      "description": "卷积、傅里叶变换、LT/Z变换等典型计算题详解。"
    },
    {
      "title": "FFT蝶形运算图解",
      "type": "知识卡",
      "description": "基2-DIT和DIF蝶形算法的详细图解与步骤。"
    },
    {
      "title": "滤波器设计实例",
      "type": "实验",
      "description": "用双线性变换法和窗函数法设计数字滤波器的完整实例。"
    }
  ],
  "publicMaterials": [
    {
      "title": "信号与系统（第三版）",
      "type": "教材",
      "description": "郑君里、应启珩、杨为理编，高等教育出版社，国内最经典教材。"
    },
    {
      "title": "信号与系统（第二版）",
      "type": "教材",
      "description": "奥本海姆(Oppenheim)等著，国际经典教材，理论严谨。"
    },
    {
      "title": "数字信号处理教程（第4版）",
      "type": "教材",
      "description": "程佩青编，清华大学出版社，国内DSP经典教材。"
    },
    {
      "title": "B站《信号与系统》",
      "type": "公开课",
      "description": "多所高校的信号与系统公开课，B站可搜索。",
      "url": "https://www.bilibili.com/video/BV1UA411s7rJ/"
    }
  ],
  "reviewNotes": [
    "信号分析与处理是通信、电子、信号处理专业的核心基础课。",
    "傅里叶变换、拉普拉斯变换、Z变换是三大核心变换，需要熟练掌握。",
    "卷积计算和零极点分析是考试高频考点。",
    "滤波器设计（IIR/FIR）是DSP部分的重点，双线性变换法和窗函数法必须掌握。",
    "考试重点：卷积计算、傅里叶变换、LT/Z变换、DFT/FFT、滤波器设计。"
  ]
}
