{
  "code": "BUPT_GIS",
  "slug": "bupt_geographic_information_systems",
  "title": "地理信息系统",
  "shortTitle": "GIS",
  "summary": "从空间数据模型和坐标系统出发，掌握矢量/栅格空间分析、遥感集成和Web GIS技术，培养空间思维与GIS软件操作能力。",
  "route": [
    "GIS概论与空间数据模型",
    "空间参考与坐标系统",
    "空间数据采集与管理",
    "空间分析（矢量/栅格）",
    "遥感与GIS集成",
    "Web GIS与前沿",
    "GIS概论",
    "空间数据模型",
    "矢量空间分析"
  ],
  "chapters": [
    {
      "title": "第1章：GIS概论",
      "focus": "GIS定义（硬件+软件+数据+方法+人员）、GIS发展简史、GIS与其他信息系统的区别、GIS应用领域（城市规划/环境监测/交通/应急）。",
      "checklist": [
        "理解GIS的五大组成部分",
        "能够区分GIS与MIS、CAD、遥感的关系",
        "了解GIS的典型应用领域",
        "了解GIS学科体系",
        "能说清GIS定义的定义、作用和适用场景",
        "能把硬件+软件+数据+方法+人员与本章其他知识点建立联系",
        "能围绕GIS发展简史完成典型题或实验步骤分析"
      ]
    },
    {
      "title": "第2章：空间数据模型",
      "focus": "矢量数据模型（点/线/面坐标表示）、栅格数据模型（像元矩阵）、矢量与栅格对比与转换、TIN模型、Geodatabase、空间拓扑关系（DE-9IM）。",
      "checklist": [
        "掌握矢量与栅格数据模型的优缺点",
        "能够选择合适的模型表达空间数据",
        "了解拓扑关系的表达方法",
        "理解Geodatabase的基本概念",
        "能说清矢量数据模型的定义、作用和适用场景",
        "能把面坐标表示与本章其他知识点建立联系",
        "能围绕栅格数据模型完成典型题或实验步骤分析"
      ]
    },
    {
      "title": "第3章：空间参考与坐标系统",
      "focus": "地球椭球体模型、大地坐标系、参心/地心坐标系（北京54/西安80/CGCS2000/WGS84）、地图投影（高斯-克吕格/UTM/兰伯特/墨卡托）、投影变形分析、坐标转换。",
      "checklist": [
        "区分地理坐标系与投影坐标系",
        "了解常见坐标系的特点与区别",
        "理解地图投影的变形类型",
        "能够进行坐标系统定义与投影变换",
        "能说清地球椭球体模型的定义、作用和适用场景",
        "能把大地坐标系与本章其他知识点建立联系",
        "能围绕参心完成典型题或实验步骤分析"
      ]
    },
    {
      "title": "第4章：空间数据采集与管理",
      "focus": "数据源分类、数字化、空间数据编辑、拓扑构建与检查、空间数据质量、空间索引（R树/四叉树）、空间查询、空间数据引擎（PostGIS）。",
      "checklist": [
        "了解空间数据的主要来源",
        "掌握拓扑检查与修复方法",
        "理解空间索引的原理",
        "能够进行空间查询（点查询/范围查询/空间连接）",
        "能说清数据源分类的定义、作用和适用场景",
        "能把数字化与本章其他知识点建立联系",
        "能围绕空间数据编辑完成典型题或实验步骤分析"
      ]
    },
    {
      "title": "第5章：矢量空间分析",
      "focus": "缓冲区分析(Buffer)、叠置分析(Intersect/Union/Erase/Identity)、网络分析（最短路径/服务区/设施选址）、空间连接(Spatial Join)、地理编码。",
      "checklist": [
        "掌握缓冲区分析的原理与操作",
        "能够区分各种叠置分析的适用场景",
        "完成最短路径和服务区网络分析",
        "理解空间连接与地理编码的应用",
        "能说清缓冲区分析的定义、作用和适用场景",
        "能把Buffer与本章其他知识点建立联系",
        "能围绕叠置分析完成典型题或实验步骤分析"
      ]
    },
    {
      "title": "第6章：栅格空间分析与DEM",
      "focus": "栅格数据基础、DEM分析（坡度/坡向/山体阴影）、视域分析(Viewshed)、栅格计算器(Map Algebra)、插值分析（IDW/Kriging/样条）、水文分析（流向/汇流/河网提取）。",
      "checklist": [
        "能够基于DEM进行地形分析",
        "掌握IDW与Kriging插值的区别",
        "能够进行视域分析",
        "了解水文分析的基本流程",
        "能说清栅格数据基础的定义、作用和适用场景",
        "能把DEM分析与本章其他知识点建立联系",
        "能围绕坡度完成典型题或实验步骤分析"
      ]
    },
    {
      "title": "第7章：遥感与GIS集成",
      "focus": "遥感物理基础（电磁波谱/大气窗口）、遥感数据源（Landsat/Sentinel/高分系列）、影像预处理、监督/非监督分类、NDVI遥感指数、变化检测。",
      "checklist": [
        "了解遥感数据的主要来源",
        "掌握监督分类的基本流程",
        "能够计算NDVI等遥感指数",
        "理解遥感与GIS集成的应用",
        "能说清遥感物理基础的定义、作用和适用场景",
        "能把电磁波谱与本章其他知识点建立联系",
        "能围绕大气窗口完成典型题或实验步骤分析"
      ]
    },
    {
      "title": "第8章：GIS空间建模",
      "focus": "ModelBuilder/ArcPy自动化建模、选址分析综合案例、三维可视化与3D分析、时空大数据分析。",
      "checklist": [
        "能够使用ModelBuilder进行自动化建模",
        "完成选址分析等综合应用案例",
        "了解三维GIS的基本功能",
        "了解GIS与大数据的结合",
        "能说清ModelBuilder的定义、作用和适用场景",
        "能把ArcPy自动化建模与本章其他知识点建立联系",
        "能围绕选址分析综合案例完成典型题或实验步骤分析"
      ]
    },
    {
      "title": "第9章：Web GIS与开源GIS",
      "focus": "Web GIS架构（OGC标准/WMS/WFS服务）、QGIS开源GIS、GeoServer/PostGIS、在线地图服务（天地图/高德API）、Leaflet/OpenLayers前端开发。",
      "checklist": [
        "理解Web GIS的基本架构",
        "能够使用QGIS完成常见GIS操作",
        "了解PostGIS空间数据库",
        "能够使用Leaflet进行简单的Web地图开发",
        "能说清Web GIS架构的定义、作用和适用场景",
        "能把OGC标准与本章其他知识点建立联系",
        "能围绕WMS完成典型题或实验步骤分析"
      ]
    },
    {
      "title": "第10章：GIS前沿与发展趋势",
      "focus": "三维GIS与数字孪生、GIS与AI结合（深度学习遥感解译）、开源GIS生态、GIS在智慧城市中的应用。",
      "checklist": [
        "了解三维GIS与数字孪生的概念",
        "了解GIS与AI结合的应用",
        "了解开源GIS生态系统",
        "了解GIS在智慧城市中的应用",
        "能说清三维GIS与数字孪生的定义、作用和适用场景",
        "能把GIS与AI结合与本章其他知识点建立联系",
        "能围绕深度学习遥感解译完成典型题或实验步骤分析"
      ]
    }
  ],
  "mindMap": [
    {
      "title": "空间数据",
      "children": [
        "矢量模型（点/线/面）",
        "栅格模型（像元矩阵）",
        "拓扑关系",
        "Geodatabase"
      ]
    },
    {
      "title": "坐标系统",
      "children": [
        "WGS84/CGCS2000",
        "高斯-克吕格投影",
        "UTM投影",
        "投影变形"
      ]
    },
    {
      "title": "矢量分析",
      "children": [
        "缓冲区分析",
        "叠置分析",
        "网络分析",
        "空间连接"
      ]
    },
    {
      "title": "栅格分析",
      "children": [
        "DEM地形分析",
        "插值分析",
        "视域分析",
        "水文分析"
      ]
    },
    {
      "title": "遥感集成",
      "children": [
        "影像分类",
        "NDVI遥感指数",
        "变化检测",
        "监督/非监督分类"
      ]
    },
    {
      "title": "Web GIS",
      "children": [
        "OGC标准",
        "QGIS开源GIS",
        "PostGIS空间数据库",
        "Leaflet前端开发"
      ]
    },
    {
      "title": "GIS概论",
      "children": [
        "GIS的五大组成部分",
        "够区分GIS与MIS、CAD、遥感的关系",
        "了解GIS的典型应用领域",
        "了解GIS学科体系",
        "GIS定义",
        "硬件+软件+数据+方法+人员"
      ]
    },
    {
      "title": "空间数据模型",
      "children": [
        "矢量与栅格数据模型的优缺点",
        "够选择合适的模型表达空间数据",
        "了解拓扑关系的表达方法",
        "Geodatabase的基本概念",
        "矢量数据模型",
        "面坐标表示"
      ]
    }
  ],
  "studySummary": [
    {
      "title": "核心概念",
      "points": [
        "GIS定义",
        "硬件+软件+数据+方法+人员",
        "矢量数据模型",
        "面坐标表示",
        "地球椭球体模型"
      ]
    },
    {
      "title": "题型抓手",
      "points": [
        "按章节路线先建立概念框架，再补公式和流程",
        "每章至少保留一类典型题或实验场景",
        "遇到综合题时先判断所属模块，再列条件和约束",
        "复习时把图谱节点和章节 checklist 对照检查"
      ]
    },
    {
      "title": "易混点",
      "points": [
        "GIS概论中的条件、公式和适用场景",
        "空间数据模型中的条件、公式和适用场景",
        "空间参考与坐标系统中的条件、公式和适用场景",
        "空间数据采集与管理中的条件、公式和适用场景",
        "矢量空间分析中的条件、公式和适用场景"
      ]
    }
  ],
  "outcomes": [
    "掌握GIS的基本概念与空间数据模型",
    "能够进行矢量和栅格空间分析",
    "了解遥感与GIS集成的基本方法",
    "具备GIS软件操作与空间问题解决能力"
  ],
  "resources": [
    {
      "title": "GIS实验操作手册",
      "type": "实验",
      "description": "涵盖ArcGIS/QGIS从入门到高级分析的完整实验指导。"
    },
    {
      "title": "Python GIS脚本库",
      "type": "实验",
      "description": "基于arcpy/geopandas的GIS自动化脚本集合。"
    },
    {
      "title": "专题地图制图模板",
      "type": "清单",
      "description": "ArcGIS/QGIS专题地图制图模板与配色方案。"
    }
  ],
  "publicMaterials": [
    {
      "title": "地理信息系统概论（第3版）",
      "type": "教材",
      "description": "黄杏元、马劲松编，高等教育出版社，最经典国内GIS教材。"
    },
    {
      "title": "QGIS官方文档",
      "type": "官方教程",
      "description": "QGIS官方教程，开源GIS学习必备。",
      "url": "https://docs.qgis.org/"
    },
    {
      "title": "武汉大学GIS MOOC",
      "type": "公开课",
      "description": "中国大学MOOC《地理信息系统概论》，龚健雅院士团队。",
      "url": "https://www.icourse163.org/course/WHU-1206446820"
    },
    {
      "title": "地理空间数据云",
      "type": "官方教程",
      "description": "提供DEM、遥感影像等空间数据下载。",
      "url": "https://www.gscloud.cn/"
    }
  ],
  "reviewNotes": [
    "GIS课程理论与实践并重，需要大量软件操作练习。",
    "坐标系统与投影变换是GIS操作的基础，也是常见考点。",
    "叠置分析和缓冲区分析是考试重点。",
    "建议同时掌握ArcGIS和QGIS，商业软件与开源软件各有优势。",
    "已按验收展示需求补充章节 checklist 和知识图谱密度，具体考试范围仍建议按老师课件确认。"
  ]
}
