{
  "code": "BUPT_RSA",
  "slug": "bupt_random_signal_analysis_b",
  "title": "随机信号分析 B",
  "shortTitle": "随机信号",
  "summary": "以随机过程为数学工具，从平稳过程、功率谱密度到窄带随机过程和高斯过程，为通信系统中的信号与噪声分析奠定基础。",
  "route": [
    "概率论基础回顾",
    "随机过程基本概念",
    "平稳过程与功率谱密度",
    "线性系统对随机信号的响应",
    "窄带随机过程",
    "高斯过程与白噪声"
  ],
  "chapters": [
    {
      "title": "第1章：概率论基础回顾",
      "focus": "条件概率、全概率公式、贝叶斯公式、随机变量的分布函数/PDF/PMF、常用分布（均匀/指数/高斯/瑞利/莱斯）、多维随机变量、特征函数、大数定律与中心极限定理。",
      "checklist": [
        "掌握条件概率与贝叶斯公式的应用",
        "能够计算常见分布的期望、方差",
        "理解瑞利分布与高斯分布的关系",
        "掌握中心极限定理的含义与适用条件"
      ]
    },
    {
      "title": "第2章：随机过程基本概念",
      "focus": "随机过程的定义（一族随机变量）、均值函数/自相关函数/自协方差函数、严平稳与宽平稳的定义与区别、各态历经性（遍历性）、联合平稳过程。",
      "checklist": [
        "理解随机过程的统计描述方法",
        "区分严平稳与宽平稳",
        "掌握遍历性的含义与验证方法",
        "能够计算随机过程的均值和自相关函数"
      ]
    },
    {
      "title": "第3章：平稳过程与功率谱密度",
      "focus": "维纳-辛钦定理（功率谱密度与自相关函数是Fourier变换对）、功率谱密度性质、白噪声过程（S(f)=N₀/2）、互功率谱密度。",
      "checklist": [
        "掌握维纳-辛钦定理的应用",
        "能够从自相关函数求功率谱密度",
        "理解白噪声的自相关函数是冲激函数",
        "掌握功率谱密度的物理意义"
      ]
    },
    {
      "title": "第4章：线性系统对随机信号的响应",
      "focus": "随机信号通过LTI系统：输出均值、输出自相关、输出功率谱 S_Y(f)=|H(f)|²S_X(f)（核心公式）、白噪声通过LTI系统、噪声等效带宽。",
      "checklist": [
        "掌握 S_Y(f)=|H(f)|²S_X(f) 的应用",
        "能够给定系统和输入求输出统计特性",
        "理解|H(f)|²是功率传递函数",
        "掌握噪声等效带宽的计算"
      ]
    },
    {
      "title": "第5章：窄带随机过程",
      "focus": "窄带信号的同相-正交分量表示 X(t)=X_c(t)cosω₀t - X_s(t)sinω₀t、X_c(t)与X_s(t)的统计特性、包络服从瑞利分布、相位服从均匀分布、窄带噪声加正弦信号的包络服从莱斯分布。",
      "checklist": [
        "掌握窄带随机过程的同相-正交分解",
        "理解零均值高斯窄带过程的包络服从瑞利分布",
        "能够推导X_c(t)、X_s(t)的相关函数与原过程功率谱的关系",
        "理解莱斯分布的产生条件"
      ]
    },
    {
      "title": "第6章：高斯过程与白噪声",
      "focus": "高斯过程的定义与性质（完全由均值和自相关函数确定）、高斯过程通过线性系统仍是高斯过程、高斯白噪声与带限高斯白噪声。",
      "checklist": [
        "理解高斯过程的完备性",
        "掌握高斯过程通过线性系统的性质",
        "区分理想白噪声与带限白噪声",
        "理解白噪声是理想化的数学模型"
      ]
    },
    {
      "title": "第7章：马尔可夫过程与Poisson过程",
      "focus": "马尔可夫性、转移概率、Chapman-Kolmogorov方程、离散时间马尔可夫链、Poisson过程的定义与性质、到达时间间隔服从指数分布。",
      "checklist": [
        "理解马尔可夫性的含义",
        "能够计算离散时间马尔可夫链的转移概率",
        "掌握Poisson过程的性质",
        "理解Poisson过程与排队论的联系"
      ]
    }
  ],
  "mindMap": [
    {
      "title": "随机过程基础",
      "children": [
        "均值/自相关/自协方差",
        "严平稳与宽平稳",
        "遍历性",
        "联合平稳"
      ]
    },
    {
      "title": "功率谱密度",
      "children": [
        "维纳-辛钦定理",
        "白噪声 S(f)=N₀/2",
        "互功率谱密度",
        "物理意义"
      ]
    },
    {
      "title": "线性系统响应",
      "children": [
        "S_Y(f)=|H(f)|²S_X(f)",
        "输出均值与自相关",
        "噪声等效带宽",
        "白噪声通过LTI系统"
      ]
    },
    {
      "title": "窄带随机过程",
      "children": [
        "同相-正交分量",
        "包络：瑞利分布",
        "相位：均匀分布",
        "正弦+噪声：莱斯分布"
      ]
    },
    {
      "title": "高斯过程",
      "children": [
        "完备性（由二阶矩确定）",
        "通过线性系统",
        "高斯白噪声",
        "带限白噪声"
      ]
    },
    {
      "title": "马尔可夫与Poisson",
      "children": [
        "转移概率",
        "Chapman-Kolmogorov方程",
        "Poisson过程",
        "指数分布间隔"
      ]
    }
  ],
  "studySummary": [
    {
      "title": "核心概念",
      "points": [
        "功率谱密度与自相关函数是Fourier变换对（维纳-辛钦定理）",
        "S_Y(f)=|H(f)|²S_X(f)是随机信号通过线性系统的核心公式",
        "窄带高斯过程的包络服从瑞利分布，加正弦信号后服从莱斯分布",
        "高斯过程完全由均值和自相关函数确定"
      ]
    },
    {
      "title": "题型抓手",
      "points": [
        "功率谱密度计算：自相关函数→FFT→功率谱",
        "线性系统响应：S_Y=|H|²S_X，注意频率范围",
        "窄带过程分解：写出同相-正交分量，求相关函数",
        "平稳性判断：检查均值是否为常数，自相关是否只依赖τ"
      ]
    },
    {
      "title": "易混点",
      "points": [
        "严平稳与宽平稳的关系（严平稳+二阶矩存在→宽平稳，反之不成立）",
        "遍历性的直观理解（一次长时间观测=多次短时间观测的集合）",
        "白噪声的自相关函数是冲激函数（频域常数↔时域冲激）",
        "为什么输出功率谱是|H(f)|²S_X(f)而非H(f)S_X(f)",
        "瑞利分布与莱斯分布的适用条件"
      ]
    }
  ],
  "outcomes": [
    "掌握随机过程的统计描述方法",
    "能够进行功率谱密度计算与线性系统响应分析",
    "理解窄带随机过程的同相-正交分解",
    "为通信系统中的信号与噪声分析奠定数学基础"
  ],
  "resources": [
    {
      "title": "随机信号分析计算练习",
      "type": "习题",
      "description": "功率谱密度、线性系统响应、窄带过程等典型计算题集。"
    },
    {
      "title": "MATLAB随机过程仿真实验",
      "type": "实验",
      "description": "基于MATLAB的随机过程生成、功率谱估计、滤波实验。"
    }
  ],
  "publicMaterials": [
    {
      "title": "随机信号分析（第4版）",
      "type": "教材",
      "description": "朱华、张旭翔编，北京邮电大学出版社，BUPT经典教材。"
    },
    {
      "title": "概率、随机变量与随机过程",
      "type": "参考书",
      "description": "Papoulis著，经典概率论与随机过程教材，推导严谨。"
    },
    {
      "title": "中国大学MOOC《随机信号分析》",
      "type": "公开课",
      "description": "多所高校开设的随机信号分析MOOC课程。"
    }
  ],
  "reviewNotes": [
    "随机信号分析需要较好的概率论和信号与系统基础。",
    "维纳-辛钦定理和S_Y=|H|²S_X是考试核心公式。",
    "窄带随机过程部分推导较多，需要理解同相-正交分量的物理意义。",
    "考试重点：功率谱密度计算、线性系统响应、瑞利/莱斯分布、遍历性判断。"
  ]
}
