{
  "code": "BUPT_CNT",
  "slug": "bupt_communication_network_theory_b",
  "title": "通信网理论基础 B",
  "shortTitle": "通信网理论",
  "summary": "以排队论和图论为数学工具，学习通信网的业务量分析、路由选择、可靠性和交换技术，为理解现代通信网络奠定理论基础。",
  "route": [
    "通信网概论与图论基础",
    "排队论基础",
    "排队网络与业务量理论",
    "通信网可靠性分析",
    "路由选择与流量分配",
    "交换技术基础"
  ],
  "chapters": [
    {
      "title": "第1章：通信网概论",
      "focus": "通信网基本组成（终端、交换、传输）、通信网分类、分层体系结构（OSI/TCP-IP模型）、性能指标（时延、吞吐量、丢包率、可用性）。",
      "checklist": [
        "理解通信网三要素（终端、交换、传输）的功能",
        "掌握OSI七层与TCP/IP四层模型的对应关系",
        "了解通信网的主要性能指标",
        "能够区分不同类型通信网的特点"
      ]
    },
    {
      "title": "第2章：图论基础与网络拓扑",
      "focus": "图的基本概念（节点、边、度）、连通图、树与生成树、最短路径算法（Dijkstra、Bellman-Ford）、最大流问题（最小割定理）、网络拓扑结构。",
      "checklist": [
        "能够手工执行Dijkstra最短路径算法",
        "理解最大流-最小割定理",
        "掌握常见网络拓扑结构的特点",
        "能够进行简单的网络拓扑分析"
      ]
    },
    {
      "title": "第3章：排队论基础",
      "focus": "泊松过程、指数分布、生灭过程、M/M/1排队系统（稳态解）、M/M/c排队系统、M/M/1/K有限容量系统、Little公式(L=λW)。这是全课数学核心。",
      "checklist": [
        "掌握M/M/1模型的五个性能指标推导与计算",
        "能够灵活运用Little公式",
        "理解ρ=λ/μ的物理含义（必须<1才有稳态）",
        "区分系统中平均顾客数L与队列中平均顾客数Lq"
      ]
    },
    {
      "title": "第4章：排队网络",
      "focus": "开环与闭环排队网络、Jackson定理（乘积形式解）、BCMP定理、串联/并联排队系统、分流与合流模型。",
      "checklist": [
        "理解Jackson网络的乘积形式解",
        "区分开环与闭环排队网络",
        "能够分析串联排队系统的性能",
        "了解Jackson定理的适用条件"
      ]
    },
    {
      "title": "第5章：通信网业务量理论",
      "focus": "话务量定义（爱尔兰Erlang）、到达率与服务率、Erlang B公式（损失制系统）、Erlang C公式（等待制系统）、Engset公式（有限源系统）。",
      "checklist": [
        "掌握Erlang B公式的应用与查表方法",
        "区分Erlang B与Erlang C的适用场景",
        "能够进行呼损率与信道数的关系计算",
        "理解业务量强度的物理含义"
      ]
    },
    {
      "title": "第6章：通信网可靠性分析",
      "focus": "可靠性指标（MTBF、MTTR、可用度）、串并联系统可靠性计算、冗余设计（热备份/冷备份）、端到端网络可用度。",
      "checklist": [
        "掌握串并联系统可靠性的组合计算",
        "能够运用可用度公式 A=MTBF/(MTBF+MTTR)",
        "区分热备份与冷备份的可靠性公式",
        "能够进行端到端网络可用度分析"
      ]
    },
    {
      "title": "第7章：路由选择与流量分配",
      "focus": "路由选择方法（固定/自适应路由）、最短路径路由、OSPF协议原理、流量工程、负载均衡、拥塞控制。",
      "checklist": [
        "理解固定路由与自适应路由的优缺点",
        "掌握Dijkstra算法在网络路由中的应用",
        "区分源路由与逐跳路由",
        "了解流量工程的基本概念"
      ]
    },
    {
      "title": "第8章：交换技术基础",
      "focus": "电路交换（时分/空分交换）、分组交换（数据报/虚电路）、ATM交换、IP交换与MPLS、交换结构（Crossbar、Clos网络）。",
      "checklist": [
        "掌握电路交换与分组交换的对比（时延、带宽利用率、适用场景）",
        "区分数据报与虚电路",
        "理解Crossbar交换矩阵的工作原理",
        "了解MPLS标签交换的基本思想"
      ]
    },
    {
      "title": "第9章：现代通信网技术",
      "focus": "TCP/IP协议栈、QoS机制（IntServ/DiffServ）、MPLS技术、SDN/NFV概述、5G网络架构概述。",
      "checklist": [
        "理解DiffServ模型的分类标记机制",
        "了解MPLS标签交换原理",
        "掌握IntServ与DiffServ的区别",
        "了解SDN/NFV的基本概念"
      ]
    }
  ],
  "mindMap": [
    {
      "title": "通信网基础",
      "children": [
        "网络三要素（终端/交换/传输）",
        "OSI与TCP-IP分层模型",
        "网络拓扑结构",
        "性能指标"
      ]
    },
    {
      "title": "图论工具",
      "children": [
        "Dijkstra最短路径",
        "最大流-最小割定理",
        "生成树",
        "网络拓扑分析"
      ]
    },
    {
      "title": "排队论",
      "children": [
        "M/M/1排队系统",
        "M/M/c排队系统",
        "Little公式",
        "Jackson网络"
      ]
    },
    {
      "title": "业务量理论",
      "children": [
        "Erlang B公式（损失制）",
        "Erlang C公式（等待制）",
        "话务量与呼损率",
        "信道数计算"
      ]
    },
    {
      "title": "可靠性与路由",
      "children": [
        "串并联可靠性",
        "可用度计算",
        "固定/自适应路由",
        "流量工程"
      ]
    },
    {
      "title": "交换技术",
      "children": [
        "电路交换",
        "分组交换",
        "Crossbar交换矩阵",
        "MPLS标签交换"
      ]
    }
  ],
  "studySummary": [
    {
      "title": "核心概念",
      "points": [
        "排队论是通信网业务量分析的数学基础，M/M/1是最基本的模型",
        "Little公式 L=λW 是连接队列长度与等待时间的桥梁",
        "Erlang B/C公式是通信网容量规划的核心工具",
        "电路交换与分组交换的对比是理解现代网络的基础"
      ]
    },
    {
      "title": "题型抓手",
      "points": [
        "M/M/1计算题：先求ρ=λ/μ，再套公式求Lq、Ls、Wq、Ws",
        "Erlang B查表题：确定A和C，查表得呼损率",
        "可靠性计算题：画出系统框图，识别串并联关系",
        "Dijkstra算法题：逐步标记最短距离，画表格"
      ]
    },
    {
      "title": "易混点",
      "points": [
        "Erlang B（损失制）与Erlang C（等待制）的适用场景区别",
        "系统中平均顾客数L与队列中平均顾客数Lq的区别",
        "电路交换的阻塞概念与分组交换的排队概念",
        "开环与闭环排队网络的区别",
        "数据报与虚电路的区别"
      ]
    }
  ],
  "outcomes": [
    "掌握排队论的基本分析方法",
    "能够进行通信网业务量与容量计算",
    "理解通信网可靠性分析方法",
    "具备通信网规划与优化的基础知识"
  ],
  "resources": [
    {
      "title": "排队论计算练习",
      "type": "习题",
      "description": "M/M/1、M/M/c、Erlang B/C等典型排队论计算题集。"
    },
    {
      "title": "Erlang B/C查表工具",
      "type": "清单",
      "description": "Erlang B和Erlang C公式查表工具，适合容量规划计算。"
    },
    {
      "title": "网络仿真与路由实验",
      "type": "实验",
      "description": "基于MATLAB/NS-3的排队仿真与路由算法实验。"
    }
  ],
  "publicMaterials": [
    {
      "title": "通信网理论基础",
      "type": "教材",
      "description": "陈德荣编，北京邮电大学出版社，BUPT经典教材。"
    },
    {
      "title": "Data Networks",
      "type": "参考书",
      "description": "Bertsekas & Gallager著，数据网络经典教材，排队论讲解深入。"
    },
    {
      "title": "中国大学MOOC《通信网理论基础》",
      "type": "公开课",
      "description": "北京邮电大学开设的MOOC课程。"
    },
    {
      "title": "Computer Networks",
      "type": "参考书",
      "description": "Tanenbaum著，计算机网络经典教材，适合补充网络协议知识。"
    }
  ],
  "reviewNotes": [
    "排队论部分数学推导较多，需要概率论和随机过程基础。",
    "Erlang B公式的查表计算是考试高频考点。",
    "Dijkstra算法的手工执行需要反复练习。",
    "考试重点：M/M/1性能指标、Little公式、Erlang B/C、串并联可靠性、Dijkstra算法。"
  ]
}
