{
  "code": "BUPT_SDD",
  "slug": "bupt_satellite_design_development",
  "title": "卫星设计与开发",
  "shortTitle": "卫星设计",
  "summary": "以微小卫星/立方星为设计对象，覆盖从需求分析到总装测试的完整卫星工程流程，强调系统级设计思维与工程实践能力。",
  "route": [
    "航天工程概论",
    "卫星总体设计",
    "结构与机构设计",
    "姿轨控分系统",
    "电源与测控分系统",
    "热控与有效载荷",
    "总装测试与综合设计项目",
    "模块一：航天工程概论",
    "模块二：卫星总体设计"
  ],
  "chapters": [
    {
      "title": "模块一：航天工程概论",
      "focus": "航天器分类（GEO/MEO/LEO卫星、深空探测器）；卫星发展历程与趋势（小卫星、星座、立方星）；卫星系统工程方法论；任务需求分析与可行性论证。",
      "checklist": [
        "能够按轨道高度对航天器进行分类并说明各类特点",
        "了解小卫星与立方星的发展趋势和典型任务",
        "掌握卫星系统工程的基本方法论",
        "能够进行初步的任务需求分析与可行性论证",
        "能说清航天器分类的定义、作用和适用场景",
        "能把GEO与本章其他知识点建立联系",
        "能围绕MEO完成典型题或实验步骤分析"
      ]
    },
    {
      "title": "模块二：卫星总体设计",
      "focus": "卫星构型设计（结构布局）；质量特性分析（质量、质心、转动惯量）；轨道设计基础（轨道要素、轨道摄动、覆盖分析）；系统级权衡分析(Trade-off Study)。",
      "checklist": [
        "掌握卫星构型设计的基本原则与布局方法",
        "能够进行质量特性分析与功率预算",
        "理解轨道六要素及轨道摄动的基本概念",
        "能够进行系统级权衡分析",
        "能说清卫星构型设计的定义、作用和适用场景",
        "能把结构布局与本章其他知识点建立联系",
        "能围绕质量特性分析完成典型题或实验步骤分析"
      ]
    },
    {
      "title": "模块三：结构与机构设计",
      "focus": "结构设计要求（刚度、强度、模态分析）；常用材料（铝合金、碳纤维复合材料、蜂窝夹层板）；有限元分析(FEA)基础；对接/分离机构设计。",
      "checklist": [
        "理解卫星结构设计的刚度与强度要求",
        "掌握常用航天结构材料的特点与选型",
        "能够使用有限元工具进行基础结构分析",
        "了解对接/分离机构的设计原理",
        "能说清结构设计要求的定义、作用和适用场景",
        "能把刚度与本章其他知识点建立联系",
        "能围绕强度完成典型题或实验步骤分析"
      ]
    },
    {
      "title": "模块四：姿轨控分系统(ADCS)",
      "focus": "姿态表示方法（欧拉角、四元数、旋转矩阵）；姿态确定传感器（太阳敏感器、星敏感器、磁强计、陀螺仪）；姿态执行机构（反作用轮、磁力矩器、推力器）；姿态控制算法（PID、LQR）。",
      "checklist": [
        "掌握欧拉角、四元数、旋转矩阵三种姿态表示方法及其转换",
        "了解各类姿态确定传感器的工作原理与适用场景",
        "理解反作用轮、磁力矩器等执行机构的工作原理",
        "能够设计基础的PID姿态控制律",
        "能说清姿态表示方法的定义、作用和适用场景",
        "能把欧拉角与本章其他知识点建立联系",
        "能围绕四元数完成典型题或实验步骤分析"
      ]
    },
    {
      "title": "模块五：电源分系统",
      "focus": "太阳电池阵设计与功率预算；储能系统（锂离子电池、超级电容）；电源管理与配电（母线架构、DC-DC变换器）；功率预算与能量平衡分析。",
      "checklist": [
        "掌握太阳电池阵的设计方法与功率计算",
        "理解卫星储能系统的选型与管理",
        "能够进行完整的功率预算与能量平衡分析",
        "了解电源母线架构与配电设计",
        "能说清太阳电池阵设计与功率预算的定义、作用和适用场景",
        "能把储能系统与本章其他知识点建立联系",
        "能围绕锂离子电池完成典型题或实验步骤分析"
      ]
    },
    {
      "title": "模块六：测控与数传分系统",
      "focus": "星地链路预算；调制解调与编码（BPSK/QPSK、卷积码/LDPC码）；星上数据管理(OBDH)；通信频段选择（UHF/S/X/Ka波段）。",
      "checklist": [
        "能够进行星地链路预算计算",
        "掌握卫星通信中常用调制编码技术",
        "了解星上数据管理系统的基本架构",
        "理解不同通信频段的特点与适用场景",
        "能说清星地链路预算的定义、作用和适用场景",
        "能把调制解调与编码与本章其他知识点建立联系",
        "能围绕BPSK完成典型题或实验步骤分析"
      ]
    },
    {
      "title": "模块七：热控分系统",
      "focus": "空间热环境分析（太阳辐射、地球辐射、深空背景）；被动热控（MLI多层隔热、热涂层、热管）；主动热控（电加热器、流体回路）；热仿真分析。",
      "checklist": [
        "理解空间热环境的特点与热载荷分析方法",
        "掌握被动热控技术（MLI、热涂层）的原理与应用",
        "了解主动热控系统的设计方法",
        "能够使用热仿真工具进行基础热分析",
        "能说清空间热环境分析的定义、作用和适用场景",
        "能把太阳辐射与本章其他知识点建立联系",
        "能围绕地球辐射完成典型题或实验步骤分析"
      ]
    },
    {
      "title": "模块八：有效载荷设计",
      "focus": "通信载荷（转发器、天线设计）；遥感载荷（相机、光谱仪）；科学载荷设计原则；载荷与平台接口设计。",
      "checklist": [
        "了解通信载荷与遥感载荷的基本设计要求",
        "理解载荷与平台之间的接口关系",
        "掌握载荷功耗、质量、尺寸的约束分析",
        "能够进行载荷选型与初步设计",
        "能说清通信载荷的定义、作用和适用场景",
        "能把转发器与本章其他知识点建立联系",
        "能围绕天线设计完成典型题或实验步骤分析"
      ]
    },
    {
      "title": "模块九：总装与测试",
      "focus": "总装流程与洁净室操作；环境试验（热真空试验、振动试验、EMC试验）；软件在环(SIL)/硬件在环(HIL)测试；发射准备与在轨测试。",
      "checklist": [
        "了解卫星总装的流程与洁净室操作规范",
        "掌握热真空、振动、EMC三大环境试验的目的与方法",
        "理解SIL/HIL测试在卫星开发中的作用",
        "了解发射准备与在轨测试的基本流程",
        "能说清总装流程与洁净室操作的定义、作用和适用场景",
        "能把环境试验与本章其他知识点建立联系",
        "能围绕热真空试验完成典型题或实验步骤分析"
      ]
    },
    {
      "title": "模块十：综合设计项目",
      "focus": "小组完成一颗微小卫星/立方星的方案设计报告；涵盖总体、结构、ADCS、电源、热控等分系统；设计评审(Design Review)与答辩。",
      "checklist": [
        "能够完成微小卫星总体方案设计报告",
        "各分系统设计计算正确（功率预算、链路预算等）",
        "具备设计评审与技术答辩的能力",
        "团队协作完成完整的卫星设计方案",
        "能说清小组完成一颗微小卫星的定义、作用和适用场景",
        "能把立方星的方案设计报告与本章其他知识点建立联系",
        "能围绕涵盖总体完成典型题或实验步骤分析"
      ]
    }
  ],
  "mindMap": [
    {
      "title": "卫星总体设计",
      "children": [
        "构型设计与结构布局",
        "质量特性分析",
        "轨道设计基础",
        "系统级权衡分析"
      ]
    },
    {
      "title": "结构与机构",
      "children": [
        "刚度与强度设计",
        "航天材料选型",
        "有限元分析(FEA)",
        "对接/分离机构"
      ]
    },
    {
      "title": "姿轨控分系统(ADCS)",
      "children": [
        "姿态表示（欧拉角/四元数）",
        "姿态确定传感器",
        "姿态执行机构",
        "PID/LQR控制算法"
      ]
    },
    {
      "title": "电源分系统",
      "children": [
        "太阳电池阵设计",
        "储能系统",
        "电源管理与配电",
        "功率预算与能量平衡"
      ]
    },
    {
      "title": "测控与数传",
      "children": [
        "星地链路预算",
        "调制解调与编码",
        "星上数据管理",
        "通信频段选择"
      ]
    },
    {
      "title": "热控分系统",
      "children": [
        "空间热环境分析",
        "被动热控（MLI/热涂层）",
        "主动热控",
        "热仿真分析"
      ]
    },
    {
      "title": "模块一：航天工程概论",
      "children": [
        "够按轨道高度对航天器进行分类并说明各类特点",
        "了解小卫星与立方星的发展趋势和典型任务",
        "卫星系统工程的基本方法论",
        "够进行初步的任务需求分析与可行性论证",
        "航天器分类",
        "GEO"
      ]
    },
    {
      "title": "模块二：卫星总体设计",
      "children": [
        "卫星构型设计的基本原则与布局方法",
        "够进行质量特性分析与功率预算",
        "轨道六要素及轨道摄动的基本概念",
        "够进行系统级权衡分析",
        "卫星构型设计",
        "结构布局"
      ]
    }
  ],
  "studySummary": [
    {
      "title": "核心概念",
      "points": [
        "航天器分类",
        "GEO",
        "卫星构型设计",
        "结构布局",
        "结构设计要求"
      ]
    },
    {
      "title": "题型抓手",
      "points": [
        "按章节路线先建立概念框架，再补公式和流程",
        "每章至少保留一类典型题或实验场景",
        "遇到综合题时先判断所属模块，再列条件和约束",
        "复习时把图谱节点和章节 checklist 对照检查"
      ]
    },
    {
      "title": "易混点",
      "points": [
        "模块一：航天工程概论中的条件、公式和适用场景",
        "模块二：卫星总体设计中的条件、公式和适用场景",
        "模块三：结构与机构设计中的条件、公式和适用场景",
        "模块四：姿轨控分系统(ADCS)中的条件、公式和适用场景",
        "模块五：电源分系统中的条件、公式和适用场景"
      ]
    }
  ],
  "outcomes": [
    "掌握卫星系统工程的完整设计流程",
    "能够使用STK、ANSYS、MATLAB等工具进行卫星设计仿真",
    "完成微小卫星/立方星的总体方案设计报告",
    "具备设计评审与技术答辩的能力"
  ],
  "resources": [
    {
      "title": "卫星总体设计模板",
      "type": "清单",
      "description": "涵盖总体、结构、ADCS、电源、热控等分系统的设计报告模板与检查清单。"
    },
    {
      "title": "STK轨道分析实验",
      "type": "实验",
      "description": "基于STK的轨道设计、覆盖分析、链路预算等实验指导。"
    },
    {
      "title": "卫星设计知识点索引",
      "type": "知识卡",
      "description": "按分系统整理卫星设计核心知识点，适合设计参考与复习。"
    }
  ],
  "publicMaterials": [
    {
      "title": "卫星工程概论",
      "type": "教材",
      "description": "王希季主编，系统介绍卫星工程的基本理论与设计方法。"
    },
    {
      "title": "Space Mission Engineering: The New SMAD",
      "type": "参考书",
      "description": "Wertz主编，国际经典卫星设计参考书，涵盖任务分析到系统设计全流程。"
    },
    {
      "title": "CubeSat Design Specification (CDS)",
      "type": "官方教程",
      "description": "立方星设计规范文档，是微小卫星设计的重要参考标准。",
      "url": "https://www.cubesat.org/"
    },
    {
      "title": "MIT OpenCourseWare 16.851 Satellite Engineering",
      "type": "公开课",
      "description": "MIT卫星工程课程，涵盖卫星系统设计的核心内容。",
      "url": "https://ocw.mit.edu/courses/16-851-satellite-engineering-fall-2003/"
    }
  ],
  "reviewNotes": [
    "卫星设计与开发课程内容广泛，需根据实际课时安排取舍模块深度。",
    "综合设计项目需要较强的团队协作能力，建议3-5人一组。",
    "STK、ANSYS等商业软件可能需要学校license支持。",
    "实际课程可能更侧重某些分系统（如ADCS或电源），需根据教学大纲调整。",
    "已按验收展示需求补充章节 checklist 和知识图谱密度，具体考试范围仍建议按老师课件确认。"
  ]
}
