{
  "code": "BUPT_EFM",
  "slug": "bupt_electromagnetic_field_microwave",
  "title": "电磁场与微波",
  "shortTitle": "电磁场微波",
  "summary": "从矢量分析和静电场出发，掌握麦克斯韦方程组和电磁波传播，再进入微波传输线、网络和元件，理论与Smith圆图实操并重。",
  "route": [
    "矢量分析与电磁场数学基础",
    "静电场与恒定场",
    "时变电磁场与麦克斯韦方程组",
    "电磁波传播",
    "导行电磁波",
    "微波传输线理论",
    "微波网络与元件",
    "静电场",
    "恒定电场与恒定磁场"
  ],
  "chapters": [
    {
      "title": "第1章：矢量分析与电磁场数学基础",
      "focus": "矢量代数、坐标系（直角、柱、球）、梯度/散度/旋度、亥姆霍兹定理、δ函数。三种正交坐标系下的微分运算是后续所有推导的基础。",
      "checklist": [
        "掌握直角、柱、球坐标系下的梯度、散度、旋度公式",
        "能够运用矢量恒等式简化场论计算",
        "理解亥姆霍兹定理的物理意义",
        "区分方向导数与梯度的关系",
        "能说清矢量代数的定义、作用和适用场景",
        "能把坐标系与本章其他知识点建立联系",
        "能围绕直角完成典型题或实验步骤分析"
      ]
    },
    {
      "title": "第2章：静电场",
      "focus": "库仑定律、电场强度、高斯定理（积分/微分形式）、电位、泊松方程/拉普拉斯方程、导体静电场、电介质极化、边界条件、电容、静电场能量。",
      "checklist": [
        "能够利用高斯定理的对称性求解电场",
        "掌握边界条件（切向E连续、法向D跃变）",
        "理解导体与介质边界条件的区别",
        "能够运用镜像法求解典型静电场问题",
        "能说清库仑定律的定义、作用和适用场景",
        "能把电场强度与本章其他知识点建立联系",
        "能围绕高斯定理完成典型题或实验步骤分析"
      ]
    },
    {
      "title": "第3章：恒定电场与恒定磁场",
      "focus": "电流密度、欧姆定律微分形式、毕奥-萨伐尔定律、安培环路定律、矢量磁位、标量磁位、磁介质磁化、磁场边界条件、电感。",
      "checklist": [
        "掌握安培环路定律的对称性应用",
        "理解矢量磁位的引入与库伦规范",
        "区分磁介质中H和B的关系",
        "能够计算典型结构的电感",
        "能说清电流密度的定义、作用和适用场景",
        "能把欧姆定律微分形式与本章其他知识点建立联系",
        "能围绕毕奥-萨伐尔定律完成典型题或实验步骤分析"
      ]
    },
    {
      "title": "第4章：时变电磁场与麦克斯韦方程组",
      "focus": "法拉第电磁感应定律、位移电流、麦克斯韦方程组（微分/积分形式）、波动方程、坡印廷定理、时谐场复数形式。四个方程的物理意义是整门课的核心。",
      "checklist": [
        "完整理解麦克斯韦方程组四个方程的物理意义",
        "区分位移电流与传导电流",
        "掌握坡印廷矢量的计算与物理含义",
        "能够写出时谐场的复数形式麦克斯韦方程",
        "能说清法拉第电磁感应定律的定义、作用和适用场景",
        "能把位移电流与本章其他知识点建立联系",
        "能围绕麦克斯韦方程组完成典型题或实验步骤分析"
      ]
    },
    {
      "title": "第5章：电磁波传播",
      "focus": "均匀平面波在无界空间中的传播、波的极化（线极化/圆极化/椭圆极化）、电磁波在导电介质中的传播（趋肤效应）、反射与透射（垂直/斜入射）、全反射。",
      "checklist": [
        "掌握波阻抗概念与反射系数/透射系数计算",
        "理解趋肤深度的物理意义与计算",
        "能够分析垂直入射和斜入射时的反射透射",
        "区分良介质与良导体的条件",
        "能说清均匀平面波在无界空间中的传播的定义、作用和适用场景",
        "能把波的极化与本章其他知识点建立联系",
        "能围绕线极化完成典型题或实验步骤分析"
      ]
    },
    {
      "title": "第6章：导行电磁波",
      "focus": "导行波一般理论、矩形波导（TE10模为主模）、圆波导、同轴线、微带线、截止频率、色散特性。",
      "checklist": [
        "掌握矩形波导中TE10模的场结构",
        "能够计算截止波长与主模传输条件",
        "理解不同模式的截止频率排序",
        "区分TE模与TM模的场分量",
        "能说清导行波一般理论的定义、作用和适用场景",
        "能把矩形波导与本章其他知识点建立联系",
        "能围绕TE10模为主模完成典型题或实验步骤分析"
      ]
    },
    {
      "title": "第7章：微波传输线理论",
      "focus": "传输线方程（电报方程）、特性阻抗、反射系数、驻波比、阻抗匹配（λ/4变换器、单stub/双stub匹配）、Smith圆图。",
      "checklist": [
        "熟练使用Smith圆图进行阻抗-导纳转换",
        "能够设计λ/4阻抗变换器",
        "掌握单stub/双stub匹配的计算方法",
        "理解反射系数、驻波比、输入阻抗之间的关系",
        "能说清传输线方程的定义、作用和适用场景",
        "能把电报方程与本章其他知识点建立联系",
        "能围绕特性阻抗完成典型题或实验步骤分析"
      ]
    },
    {
      "title": "第8章：微波网络基础",
      "focus": "微波网络等效电路、阻抗矩阵[Z]、导纳矩阵[Y]、散射矩阵[S]、传输矩阵[ABCD]、信号流图。S矩阵的物理意义与测量是重点。",
      "checklist": [
        "掌握S矩阵的物理意义与各参数含义",
        "能够进行各种网络参数矩阵之间的互换",
        "理解信号流图的化简方法",
        "能够求解多端口网络的S参数",
        "能说清微波网络等效电路的定义、作用和适用场景",
        "能把阻抗矩阵与本章其他知识点建立联系",
        "能围绕导纳矩阵完成典型题或实验步骤分析"
      ]
    },
    {
      "title": "第9章：微波谐振器",
      "focus": "谐振器基本参数（谐振频率、品质因数Q、等效电导）、矩形谐振腔、圆柱谐振腔、同轴谐振腔、微带谐振器。",
      "checklist": [
        "掌握谐振频率的计算方法",
        "区分有载Q、无载Q、外部Q的定义与关系",
        "能够计算矩形谐振腔的谐振频率",
        "了解不同谐振模式的特点",
        "能说清谐振器基本参数的定义、作用和适用场景",
        "能把谐振频率与本章其他知识点建立联系",
        "能围绕品质因数Q完成典型题或实验步骤分析"
      ]
    },
    {
      "title": "第10章：微波元件与应用",
      "focus": "衰减器、移相器、定向耦合器、功分器、环形器、隔离器、铁氧体器件原理。定向耦合器的耦合度和隔离度计算是重点。",
      "checklist": [
        "掌握定向耦合器的耦合度和隔离度计算",
        "理解功分器的工作原理",
        "了解铁氧体器件的非互易特性",
        "能够分析典型微波元件的S参数矩阵",
        "能说清衰减器的定义、作用和适用场景",
        "能把移相器与本章其他知识点建立联系",
        "能围绕定向耦合器完成典型题或实验步骤分析"
      ]
    }
  ],
  "mindMap": [
    {
      "title": "电磁场基础",
      "children": [
        "矢量分析（梯度/散度/旋度）",
        "静电场与高斯定理",
        "恒定磁场与安培环路定律",
        "麦克斯韦方程组"
      ]
    },
    {
      "title": "电磁波传播",
      "children": [
        "均匀平面波",
        "波的极化",
        "趋肤效应",
        "反射与透射"
      ]
    },
    {
      "title": "导行波",
      "children": [
        "矩形波导TE10模",
        "截止频率与色散",
        "同轴线与微带线",
        "模式场结构"
      ]
    },
    {
      "title": "微波传输线",
      "children": [
        "传输线方程",
        "Smith圆图",
        "阻抗匹配（λ/4变换器、stub）",
        "驻波比与反射系数"
      ]
    },
    {
      "title": "微波网络",
      "children": [
        "S矩阵参数",
        "Z/Y/ABCD矩阵",
        "信号流图",
        "网络参数互换"
      ]
    },
    {
      "title": "微波元件",
      "children": [
        "定向耦合器",
        "功分器",
        "谐振器",
        "铁氧体器件"
      ]
    },
    {
      "title": "矢量分析与电磁场数学基础",
      "children": [
        "直角、柱、球坐标系下的梯度、散度、旋度公式",
        "够运用矢量恒等式简化场论计算",
        "亥姆霍兹定理的物理意义",
        "方向导数与梯度的关系",
        "矢量代数",
        "坐标系"
      ]
    },
    {
      "title": "静电场",
      "children": [
        "够利用高斯定理的对称性求解电场",
        "边界条件（切向E连续、法向D跃变）",
        "导体与介质边界条件的区别",
        "够运用镜像法求解典型静电场问题",
        "库仑定律",
        "电场强度"
      ]
    }
  ],
  "studySummary": [
    {
      "title": "核心概念",
      "points": [
        "矢量代数",
        "坐标系",
        "库仑定律",
        "电场强度",
        "电流密度"
      ]
    },
    {
      "title": "题型抓手",
      "points": [
        "按章节路线先建立概念框架，再补公式和流程",
        "每章至少保留一类典型题或实验场景",
        "遇到综合题时先判断所属模块，再列条件和约束",
        "复习时把图谱节点和章节 checklist 对照检查"
      ]
    },
    {
      "title": "易混点",
      "points": [
        "矢量分析与电磁场数学基础中的条件、公式和适用场景",
        "静电场中的条件、公式和适用场景",
        "恒定电场与恒定磁场中的条件、公式和适用场景",
        "时变电磁场与麦克斯韦方程组中的条件、公式和适用场景",
        "电磁波传播中的条件、公式和适用场景"
      ]
    }
  ],
  "outcomes": [
    "掌握麦克斯韦方程组的物理意义与应用",
    "熟练使用Smith圆图进行阻抗匹配设计",
    "能够分析矩形波导中电磁波的传输特性",
    "具备微波网络参数的计算与分析能力"
  ],
  "resources": [
    {
      "title": "Smith圆图练习工具",
      "type": "实验",
      "description": "在线Smith圆图交互工具，适合反复练习阻抗匹配计算。"
    },
    {
      "title": "电磁场与微波知识点速查",
      "type": "知识卡",
      "description": "按章节整理核心公式与关键概念，适合考前复习。"
    },
    {
      "title": "波导与谐振腔设计实验",
      "type": "实验",
      "description": "基于HFSS/CST的波导与谐振腔仿真实验指导。"
    }
  ],
  "publicMaterials": [
    {
      "title": "电磁场与电磁波（第4版）",
      "type": "教材",
      "description": "谢处方、饶克谨编，高等教育出版社，国内最经典的电磁场教材。"
    },
    {
      "title": "微波技术基础（第3版）",
      "type": "教材",
      "description": "廖承恩编，西安电子科技大学出版社，微波技术部分的标准教材。"
    },
    {
      "title": "微波工程（第3版）",
      "type": "参考书",
      "description": "David M. Pozar著，国际经典微波工程教材，讲解深入。"
    },
    {
      "title": "中国大学MOOC《电磁场与电磁波》",
      "type": "公开课",
      "description": "电子科技大学开设的MOOC课程，配合教材学习效果好。"
    }
  ],
  "reviewNotes": [
    "电磁场与微波课程数学推导较多，需确认学生的矢量分析和偏微分方程基础。",
    "Smith圆图的使用需要大量练习，建议配合在线工具。",
    "微波网络S矩阵部分可能需要结合实验（矢量网络分析仪）加深理解。",
    "考试重点集中在麦克斯韦方程组、Smith圆图、波导和S矩阵计算。",
    "已按验收展示需求补充章节 checklist 和知识图谱密度，具体考试范围仍建议按老师课件确认。"
  ]
}
