{
  "code": "BUPT_DM",
  "slug": "bupt_discrete_math",
  "title": "离散数学",
  "shortTitle": "离散",
  "summary": "围绕离散数学的章节顺序，先抓主干概念，再用公式、题型和易错点做验收复习。",
  "route": [
    "命题逻辑",
    "一阶逻辑",
    "集合的概念与运算",
    "二元关系和函数",
    "图的基本概念",
    "特殊的图",
    "树",
    "组合分析初步"
  ],
  "chapters": [
    {
      "title": "第 1 章：命题逻辑",
      "focus": "本章介绍命题逻辑的基本概念，包括命题与联结词、命题公式及分类、等值演算、范式、联结词全功能集、组合电路以及推理理论。核心在于掌握命题符号化、真值表、等值演算、主析取/主合取范式和构造证明法。",
      "checklist": [
        "能准确判断一个语句是否为命题，并区分简单命题与复合命题",
        "能将自然语言命题正确符号化，尤其是含'或''除非''只有...才...'等复杂句",
        "能熟练构造命题公式的真值表并判断其类型（重言式/矛盾式/可满足式）",
        "能运用24个基本等值式进行等值演算，验证等值式或化简公式",
        "能求出任意命题公式的主析取范式和主合取范式",
        "能利用主范式判断两个公式是否等值、求成真/成假赋值"
      ]
    },
    {
      "title": "第 2 章：一阶逻辑",
      "focus": "本章介绍一阶逻辑（谓词逻辑）的基本概念，包括个体词、谓词、量词以及命题符号化方法；给出合式公式的严格定义、解释与赋值、公式的分类（逻辑有效式/矛盾式/可满足式）；讨论一阶逻辑中的等值式（量词否定、辖域收缩与扩张、量词分配等）以及前束范式的概念与求解方法。",
      "checklist": [
        "能将自然语言命题正确地在一阶逻辑中符号化（含不同个体域和特性谓词）",
        "能准确识别合式公式中的指导变项、辖域、约束出现和自由出现",
        "能正确使用换名规则避免变项混淆",
        "能根据给定解释和赋值计算公式的真值",
        "能判断给定公式是否为逻辑有效式、矛盾式或可满足式",
        "能熟练运用量词否定、辖域收缩扩张、分配等值式进行公式变形"
      ]
    },
    {
      "title": "第 3 章：集合的概念与运算",
      "focus": "本章介绍集合的基本概念（元素、子集、相等、真子集、空集、幂集、全集），集合的基本运算（并、交、相对补、绝对补、对称差）及其算律，以及有穷集元素计数的文氏图法和包含排斥原理，并通过大量例题与习题训练集合表达式的建立、恒等式证明与计数问题的求解。",
      "checklist": [
        "能正确使用列举法和谓词法表示集合",
        "能准确判断元素与集合、集合与集合之间的各种关系（∈、⊆、=、⊂）",
        "能熟练计算并、交、相对补、绝对补、对称差，并用文氏图表示",
        "能熟记并运用集合运算的23条基本算律进行恒等变形",
        "能使用命题演算法、恒等变形法、反证法证明集合恒等式",
        "能利用文氏图法和包含排斥原理解决有穷计数问题"
      ]
    },
    {
      "title": "第 4 章：二元关系和函数",
      "focus": "本章从有序对和笛卡儿积出发，系统介绍二元关系的定义、表示（关系矩阵、关系图）、基本运算（逆、合成、限制、像、幂）及性质（自反、反自反、对称、反对称、传递），进而讨论关系的闭包、等价关系与偏序关系，最后引入函数的定义、性质（单射、满射、双射）、复合与反函数，并给出多个应用实例。",
      "checklist": [
        "能准确写出笛卡儿积，并用集合表达式定义二元关系",
        "能画出关系矩阵和关系图，并能相互转换",
        "能熟练计算关系的逆、合成、限制、像和幂",
        "能通过关系矩阵或关系图判断关系的五类性质",
        "会求关系的自反闭包、对称闭包和传递闭包",
        "能证明等价关系，求等价类和商集，理解划分与等价关系的一一对应"
      ]
    },
    {
      "title": "第 5 章：图的基本概念",
      "focus": "本章系统介绍图论的基础知识，包括无向图与有向图的定义、顶点的度数与握手定理、简单图/多重图/完全图/子图/补图/图同构等基本概念，通路、回路与图的连通性（弱连通、单向连通、强连通），图的矩阵表示（关联矩阵、邻接矩阵、可达矩阵），以及最短路径（Dijkstra算法）、关键路径和图着色等应用问题。",
      "checklist": [
        "能准确写出无向图和有向图的数学定义",
        "能用握手定理及其推论判断度数序列的合法性",
        "能区分简单图、多重图、完全图、子图、补图等概念",
        "能判断两个图是否同构（至少会用必要条件排除不同构）",
        "能准确区分初级通路、简单通路、复杂通路及对应的回路",
        "能判断无向图的连通性及有向图的弱/单向/强连通性"
      ]
    },
    {
      "title": "第 6 章：特殊的图",
      "focus": "本章介绍四种特殊图类：二部图（含匹配与Hall定理）、欧拉图（含欧拉回路/通路的判别）、哈密顿图（含必要与充分条件）和平面图（含欧拉公式、库拉托夫斯基定理、对偶图与四色定理）。",
      "checklist": [
        "能判断给定无向图是否为二部图",
        "能区分极大匹配、最大匹配、完美匹配和完备匹配",
        "能运用Hall定理和t条件判断完备匹配是否存在",
        "能判断无向图和有向图是否为欧拉图/存在欧拉通路",
        "能判断图是否为哈密顿图/存在哈密顿通路",
        "能计算平面图的顶点、边、面数量关系（欧拉公式）"
      ]
    },
    {
      "title": "第 7 章：树",
      "focus": "本章分为无向树及生成树、根树及其应用两大部分。第一部分给出无向树的多种等价定义，介绍生成树、树枝、弦、余树、基本回路系统、基本割集系统的概念，以及用避圈法（Kruskal算法）求最小生成树。第二部分介绍根树及其家族树术语、层数与树高、r叉树分类，重点讨论最优二叉树的Huffman算法、用二叉树产生最佳二元前缀码，以及算式的前缀符号法（波兰符号法）和后缀符号法（逆波兰符号法）。",
      "checklist": [
        "能判断一个无向图是否为树，并用等价定义进行证明",
        "能利用握手定理和m=n-1求解树中未知顶点数或树叶数",
        "能画出小阶数所有非同构的无向树",
        "能求连通图的一棵生成树、基本回路系统和基本割集系统",
        "能用避圈法求最小生成树并计算其权",
        "能准确说出根树中树根、内点、树叶、层数、树高等概念"
      ]
    },
    {
      "title": "第 8 章：组合分析初步",
      "focus": "本章介绍组合数学中的基本计数方法，包括加法法则与乘法法则、集合与多重集的排列组合计数，以及递推方程的迭代求解方法及其在算法分析中的应用。",
      "checklist": [
        "能正确区分加法法则与乘法法则的适用场景",
        "能判断计数问题是排列还是组合、是否允许重复",
        "能熟练运用P(n,r)、C(n,r)、多重集排列及组合公式进行计数",
        "能根据递归算法建立递推方程并写出初值",
        "能用迭代法求解形如T(n)=aT(n/b)+d(n)的递推方程",
        "能估计递推方程解的阶并用于算法时间复杂度分析"
      ]
    },
    {
      "title": "第 9 章：代数系统简介",
      "focus": "本章从二元运算及其基本性质出发，给出代数系统的一般定义，介绍子代数与积代数，重点讨论半群、独异点、群、环、域、格与布尔代数等典型代数系统的定义、性质与判定方法，并引入同态与同构作为研究代数系统之间关系的工具。",
      "checklist": [
        "能判断给定运算在集合上是否封闭并列出运算表",
        "能识别并证明交换律、结合律、幂等律、分配律、吸收律和消去律",
        "能准确找出给定代数运算的么元、零元和逆元",
        "能判定一个代数系统是否为半群、独异点或群",
        "能利用子群判定定理判断非空子集是否为子群",
        "能确定循环群的生成元并找出所有子群"
      ]
    },
    {
      "title": "第 10 章：形式语言和自动机初步",
      "focus": "本章介绍形式文法、有穷自动机、图灵机以及正则语言和上下文无关语言在计算机科学与技术中的应用。内容包括字符串与形式语言的基本概念、乔姆斯基四型文法、DFA/NFA/ε-NFA的定义与等价性、正则表达式及其与正则文法和自动机的等价关系、图灵机的基本模型与计算过程。",
      "checklist": [
        "能准确判断给定文法属于乔姆斯基哪一型",
        "能写出给定文法生成语言的集合表示或某字符串的派生过程",
        "能构造接受特定语言的DFA和NFA",
        "能将NFA转化为等价的DFA（子集构造法）",
        "能将带ε转移的NFA转化为不含ε转移的NFA",
        "能写出描述特定语言的正则表达式"
      ]
    }
  ],
  "mindMap": [
    {
      "title": "命题逻辑",
      "children": [
        "命题必须是有唯一真值的陈述句",
        "五种基本联结词的定义",
        "排斥或与相容或的区别",
        "蕴涵式p→q的逻辑关系",
        "命题公式类型的判断"
      ]
    },
    {
      "title": "一阶逻辑",
      "children": [
        "个体词、谓词与量词",
        "n元谓词与0元谓词",
        "个体域与特性谓词",
        "量词顺序",
        "指导变项、辖域与约束/自由出现"
      ]
    },
    {
      "title": "集合的概念与运算",
      "children": [
        "集合的表示方法",
        "子集、相等与真子集的符号化定义",
        "空集与幂集",
        "五种基本运算的定义",
        "集合运算算律"
      ]
    },
    {
      "title": "二元关系和函数",
      "children": [
        "有序对与笛卡儿积",
        "关系的五类基本性质",
        "关系的闭包",
        "等价关系与划分的一一对应",
        "偏序关系与哈斯图"
      ]
    },
    {
      "title": "图的基本概念",
      "children": [
        "无向图与有向图的数学定义",
        "握手定理及其推论",
        "简单图与完全图",
        "图同构",
        "通路与回路的分类"
      ]
    },
    {
      "title": "特殊的图",
      "children": [
        "二部图的判定",
        "匹配的分类",
        "Hall定理（相异性条件）",
        "欧拉图判别",
        "哈密顿图必要条件"
      ]
    },
    {
      "title": "树",
      "children": [
        "无向树的等价定义",
        "n阶非平凡树至少有两片树叶",
        "生成树存在性",
        "基本回路与基本回路系统",
        "基本割集与基本割集系统"
      ]
    },
    {
      "title": "组合分析初步",
      "children": [
        "加法法则",
        "乘法法则",
        "集合的r-排列",
        "多重集的r-排列与全排列",
        "多重集的r-组合"
      ]
    }
  ],
  "studySummary": [
    {
      "title": "核心概念",
      "points": [
        "命题必须是有唯一真值的陈述句",
        "五种基本联结词的定义",
        "排斥或与相容或的区别",
        "蕴涵式p→q的逻辑关系"
      ]
    },
    {
      "title": "题型抓手",
      "points": [
        "按章节 checklist 逐项自测",
        "优先复盘公式、例题和典型问答",
        "把章节间前后置关系串成路线"
      ]
    },
    {
      "title": "易混点",
      "points": [
        "PDF提取文本中部分公式符号存在乱码或缺失（如第13-15行、第74-75行、第280-281行等处），实际内容需对照原书确认。",
        "教材中表1-4、表1-9、表1-10、表1-11、表1-13、表1-14、表1-15等因OCR提取为乱码，具体内容未完整纳入，相关例题描述以文本中可辨识的部分为准。",
        "部分例题编号和引用（如例1.12、例1.15、例1.19等）在文本中交叉出现，但前文对应例题内容可能因排版问题未完全识别。",
        "OCR文本中多处符号识别混乱（如'7'应为¬、'名'应为⇔、'叶'应为⇔/→、'引'应为∃），导致部分公式和推理过程难以100%确认"
      ]
    }
  ],
  "outcomes": [
    "形成章节路线图",
    "整理每章 checklist",
    "沉淀考试/实验复习重点"
  ],
  "resources": [
    {
      "title": "离散章节复习清单",
      "type": "清单",
      "description": "由已填充章节 JSON 自动汇总生成，适合验收前快速浏览。"
    },
    {
      "title": "离散知识点索引",
      "type": "知识卡",
      "description": "按章节抽取 keyPoints 和知识结构，后续可继续人工精修。"
    }
  ],
  "publicMaterials": [],
  "reviewNotes": [
    "需人工确认：组合电路与奎因-莫可拉斯基方法是否属于考试范围，因不同课程大纲侧重点不同。",
    "需人工确认：教材中提到的'置换定理'及其证明是否要求掌握，还是仅要求会用置换规则。",
    "需人工确认：推理理论中'公理系统'与'自然推理系统'的区分是否属于本章考核要求。",
    "需人工确认：量词交换等值式部分由于OCR文本不清晰，∀x∀yA↔∀y∀xA和∃x∃yA↔∃y∃xA的具体内容需以教材为准",
    "需人工确认：公式中部分符号（如'7'代表否定、'名'代表等值、'叶'代表等值或蕴含）的识别基于OCR上下文推断，实际印刷符号请以教材为准",
    "需人工确认：苏格拉底三段论及例2.10中的等值/蕴涵关系，因OCR存在乱码，具体符号表达建议对照教材核实",
    "需人工确认：suggestedResources仅列出教材，若需补充公开课/视频请自行添加",
    "需人工确认：欧拉函数、错位排列、素数计数等应用例题在教材中属于提高内容，需结合个人课程要求判断考试深度"
  ]
}
