{
  "code": "BUPT_RCP",
  "slug": "bupt_reflection_communication_practice",
  "title": "反射通信实践",
  "shortTitle": "反射通信",
  "summary": "以动手实验为核心，从反射通信基础理论到无源RFID、环境反向散射、WiFi/蜂窝反射通信，逐步搭建完整的反射通信系统原型。",
  "route": [
    "反射通信基础理论",
    "无源RFID系统实验",
    "环境反向散射通信",
    "反射通信硬件平台搭建",
    "信号处理与解调实验",
    "WiFi与蜂窝反向散射实验",
    "物联网应用与综合项目",
    "模块一：反射通信基础理论",
    "模块二：无源RFID系统实验"
  ],
  "chapters": [
    {
      "title": "模块一：反射通信基础理论",
      "focus": "反射通信原理（backscatter）与传统无线电的区别；RFID系统架构（标签、阅读器、天线）；电磁波反射与散射的物理机制；ASK/PSK/FSK在反射通信中的调制应用。",
      "checklist": [
        "能够解释反射通信与传统无线电通信的本质区别",
        "掌握RFID系统三大组成部分及其功能",
        "理解电磁波反射与散射的物理机制",
        "能说明ASK、PSK、FSK在反射通信中的应用场景",
        "能说清反射通信原理的定义、作用和适用场景",
        "能把backscatter与本章其他知识点建立联系",
        "能围绕与传统无线电的区别完成典型题或实验步骤分析"
      ]
    },
    {
      "title": "模块二：无源RFID系统实验",
      "focus": "LF/HF/UHF RFID系统对比；ISO 14443/15693/18000-6C(EPC Gen2)协议基础；RFID读写器操作与标签读写实验；防碰撞算法（ALOHA、树形搜索）。",
      "checklist": [
        "能够区分LF、HF、UHF频段RFID系统的特点与应用场景",
        "掌握EPC Gen2协议的基本工作流程",
        "独立完成RFID标签的读写操作实验",
        "理解ALOHA和树形搜索防碰撞算法的原理与区别",
        "能说清LF的定义、作用和适用场景",
        "能把HF与本章其他知识点建立联系",
        "能围绕UHF RFID系统对比完成典型题或实验步骤分析"
      ]
    },
    {
      "title": "模块三：环境反向散射通信(Ambient Backscatter)",
      "focus": "环境射频信号（TV、WiFi、蜂窝基站）的利用；Ambient Backscatter通信原理；发射机设计（反射/吸收状态切换）；接收机设计（能量检测与包络检波）。",
      "checklist": [
        "理解Ambient Backscatter如何利用已有环境射频信号进行通信",
        "掌握反射/吸收状态切换的实现原理",
        "能设计能量检测接收机的基本方案",
        "了解环境反向散射通信的典型应用场景",
        "能说清环境射频信号的定义、作用和适用场景",
        "能把TV与本章其他知识点建立联系",
        "能围绕WiFi完成典型题或实验步骤分析"
      ]
    },
    {
      "title": "模块四：反射通信硬件平台搭建",
      "focus": "反射通信节点硬件设计基础；射频前端电路（功率分配器、混频器、天线匹配）；微控制器（STM32/Arduino）与射频模块集成；PCB设计基础。",
      "checklist": [
        "掌握射频前端电路的基本组成与设计要点",
        "能够完成微控制器与射频模块的集成调试",
        "了解PCB设计中射频电路的注意事项",
        "能够使用开发板搭建反射通信实验平台",
        "能说清反射通信节点硬件设计基础的定义、作用和适用场景",
        "能把射频前端电路与本章其他知识点建立联系",
        "能围绕功率分配器完成典型题或实验步骤分析"
      ]
    },
    {
      "title": "模块五：信号处理与解调实验",
      "focus": "反射信号的采集与预处理；数字解调算法实现（阈值判决、相干/非相干检测）；误码率(BER)测试与分析；信道模型仿真（路径损耗、多径衰落）。",
      "checklist": [
        "能够完成反射信号的采集与预处理流程",
        "实现阈值判决和非相干检测解调算法",
        "独立完成BER性能测试并分析结果",
        "理解多径衰落对反射通信性能的影响",
        "能说清反射信号的采集与预处理的定义、作用和适用场景",
        "能把数字解调算法实现与本章其他知识点建立联系",
        "能围绕阈值判决完成典型题或实验步骤分析"
      ]
    },
    {
      "title": "模块六：WiFi与蜂窝反向散射实验",
      "focus": "WiFi Backscatter系统设计与实现；利用商用WiFi路由器作为信号源；蜂窝网络反向散射（LTE/5G信号反射）；跨协议反射通信。",
      "checklist": [
        "能够设计并实现基于WiFi信号的反向散射通信系统",
        "理解跨协议反射通信的基本原理",
        "完成蜂窝信号反射通信的基础实验",
        "分析不同环境射频源对反射通信性能的影响",
        "能说清利用商用WiFi路由器作为信号源的定义、作用和适用场景",
        "能把蜂窝网络反向散射与本章其他知识点建立联系",
        "能围绕LTE完成典型题或实验步骤分析"
      ]
    },
    {
      "title": "模块七：物联网应用与综合项目",
      "focus": "无源传感器网络设计；反射通信与能量收集（Energy Harvesting）结合；智能标签/智能包装应用场景；反射通信距离扩展技术；综合项目设计与演示。",
      "checklist": [
        "理解反射通信在物联网无源传感器网络中的应用",
        "掌握能量收集技术与反射通信结合的基本方案",
        "能够设计并实现一个完整的反射通信系统原型",
        "撰写规范的实验报告与技术文档",
        "能说清无源传感器网络设计的定义、作用和适用场景",
        "能把反射通信与能量收集与本章其他知识点建立联系",
        "能围绕Energy Harvesting完成典型题或实验步骤分析"
      ]
    }
  ],
  "mindMap": [
    {
      "title": "反射通信原理",
      "children": [
        "Backscatter基本原理",
        "与传统无线电通信的区别",
        "电磁波反射与散射机制",
        "ASK/PSK/FSK调制方式"
      ]
    },
    {
      "title": "RFID技术",
      "children": [
        "LF/HF/UHF频段对比",
        "EPC Gen2协议",
        "防碰撞算法（ALOHA、树形搜索）",
        "读写器与标签交互"
      ]
    },
    {
      "title": "环境反向散射",
      "children": [
        "Ambient Backscatter原理",
        "环境射频信号利用",
        "反射/吸收状态切换",
        "能量检测接收机"
      ]
    },
    {
      "title": "硬件平台搭建",
      "children": [
        "射频前端电路设计",
        "微控制器集成",
        "PCB设计要点",
        "SDR平台（USRP/HackRF）"
      ]
    },
    {
      "title": "信号处理与测试",
      "children": [
        "数字解调算法",
        "BER性能测试",
        "信道模型仿真",
        "多径衰落影响分析"
      ]
    },
    {
      "title": "物联网应用",
      "children": [
        "无源传感器网络",
        "能量收集技术",
        "智能标签应用",
        "距离扩展技术"
      ]
    },
    {
      "title": "模块一：反射通信基础理论",
      "children": [
        "够解释反射通信与传统无线电通信的本质区别",
        "RFID系统三大组成部分及其功能",
        "电磁波反射与散射的物理机制",
        "说明ASK、PSK、FSK在反射通信中的应用场景",
        "反射通信原理",
        "backscatter"
      ]
    },
    {
      "title": "模块二：无源RFID系统实验",
      "children": [
        "EPC Gen2协议的基本工作流程",
        "独立完成RFID标签的读写操作实验",
        "ALOHA和树形搜索防碰撞算法的原理与区别",
        "LF",
        "HF",
        "UHF RFID系统对比"
      ]
    }
  ],
  "studySummary": [
    {
      "title": "核心概念",
      "points": [
        "反射通信原理",
        "backscatter",
        "LF",
        "HF",
        "环境射频信号"
      ]
    },
    {
      "title": "题型抓手",
      "points": [
        "按章节路线先建立概念框架，再补公式和流程",
        "每章至少保留一类典型题或实验场景",
        "遇到综合题时先判断所属模块，再列条件和约束",
        "复习时把图谱节点和章节 checklist 对照检查"
      ]
    },
    {
      "title": "易混点",
      "points": [
        "模块一：反射通信基础理论中的条件、公式和适用场景",
        "模块二：无源RFID系统实验中的条件、公式和适用场景",
        "模块三：环境反向散射通信(Ambient Backscatter)中的条件、公式和适用场景",
        "模块四：反射通信硬件平台搭建中的条件、公式和适用场景",
        "模块五：信号处理与解调实验中的条件、公式和适用场景"
      ]
    }
  ],
  "outcomes": [
    "掌握反射通信系统从理论到实验的完整流程",
    "能够独立搭建基于SDR的反射通信实验平台",
    "完成WiFi/蜂窝反向散射通信实验",
    "设计并演示一个完整的反射通信系统原型"
  ],
  "resources": [
    {
      "title": "反射通信实验指导手册",
      "type": "实验",
      "description": "涵盖RFID、环境反向散射、WiFi反射通信等核心实验的操作步骤与报告模板。"
    },
    {
      "title": "GNU Radio反射通信模块",
      "type": "实验",
      "description": "基于GNU Radio的反射通信信号处理实验模块，适合SDR平台验证。"
    },
    {
      "title": "反射通信知识点索引",
      "type": "知识卡",
      "description": "按模块整理反射通信核心知识点，适合实验前预习和考前复习。"
    }
  ],
  "publicMaterials": [
    {
      "title": "RFID原理与应用",
      "type": "教材",
      "description": "系统介绍RFID技术原理、协议标准和典型应用，适合入门反射通信。"
    },
    {
      "title": "GNU Radio官方教程",
      "type": "官方教程",
      "description": "GNU Radio官方文档与教程，涵盖SDR基础到高级信号处理。",
      "url": "https://wiki.gnuradio.org/"
    },
    {
      "title": "Ambient Backscatter论文 (SIGCOMM 2013)",
      "type": "参考书",
      "description": "Liu et al. 提出Ambient Backscatter的经典论文，理解环境反向散射的理论基础。"
    },
    {
      "title": "NI/ADI SDR教学资源",
      "type": "官方教程",
      "description": "NI和ADI提供的SDR教学资源与实验案例，适合硬件平台搭建参考。"
    }
  ],
  "reviewNotes": [
    "反射通信实践为实验类课程，各校实验设备和平台差异较大，需根据实际实验室条件调整。",
    "环境反向散射实验需要稳定的环境射频信号源，实验条件可能受限。",
    "WiFi Backscatter实验可能需要专用硬件模块，需确认实验室是否具备。",
    "综合项目的评分标准需根据实际课程要求调整。",
    "已按验收展示需求补充章节 checklist 和知识图谱密度，具体考试范围仍建议按老师课件确认。"
  ]
}
